id_project,project_id,project_name,project_desc,user_id,deadline,game_type,imgUrl
919,2f701168-6eef-4b8b-b13a-a93c36208241,phasellus,convallis duis consequat dui nec nisi volutpat eleifend donec ut dolor morbi vel lectus in quam fringilla rhoncus mauris,6593571b-33c5-4447-9bf8-44291384abcf,12/20/2023,Open World,http://dummyimage.com/117x100.png/dddddd/000000
920,33d4af7c-794c-4701-95bf-7d2402a968bd,justo,tempus vivamus in felis eu sapien cursus vestibulum proin eu mi nulla ac enim in tempor turpis nec,aa183068-2c00-4ddc-9d1f-7dc3ce2ab90f,10/21/2023,FPS,http://dummyimage.com/163x100.png/5fa2dd/ffffff
921,8863a7e1-b451-4b64-9956-c1d83c48c418,in sapien iaculis,pharetra magna vestibulum aliquet ultrices erat tortor sollicitudin mi sit amet lobortis sapien sapien non,83ca8d25-2214-4a4c-87a7-6a432adb36b2,1/20/2023,Adventure,http://dummyimage.com/103x100.png/cc0000/ffffff
922,ce7c142a-27cb-43a0-90ce-26e10c6a2cfc,non,hac habitasse platea dictumst morbi vestibulum velit id pretium iaculis diam erat,c4bc2280-601e-43d6-99ae-00c166539080,2/15/2023,Moba,http://dummyimage.com/119x100.png/dddddd/000000
923,1784b21c-8e4b-4f83-bf56-cdc92e08f7ac,velit donec,morbi porttitor lorem id ligula suspendisse ornare consequat lectus in est risus auctor sed tristique in tempus sit amet sem,0bc0a153-e880-45f3-9c43-40b79212983a,3/23/2023,Open World,http://dummyimage.com/150x100.png/ff4444/ffffff
924,74a7fb44-ff3a-42af-a5b6-b190e92f0a92,pretium quis,lorem id ligula suspendisse ornare consequat lectus in est risus auctor sed tristique in tempus sit amet sem fusce,8ae4839e-efa1-4445-8468-89561b9f000b,9/29/2023,Puzzle,http://dummyimage.com/200x100.png/cc0000/ffffff
925,af969373-79f6-4171-b71c-f168ea6bc2e4,tellus in,justo etiam pretium iaculis justo in hac habitasse platea dictumst etiam faucibus cursus urna,7af09e7d-1297-405d-bf56-7f80a948a8a4,5/26/2023,Open World,http://dummyimage.com/173x100.png/cc0000/ffffff
926,abf9e4b1-ceba-404d-9ca1-b0455832a8a1,magna vestibulum aliquet,pellentesque quisque porta volutpat erat quisque erat eros viverra eget congue eget semper rutrum nulla nunc purus,38daf5c9-f827-45cd-8546-0b06064bc285,6/13/2023,RPG,http://dummyimage.com/208x100.png/cc0000/ffffff
927,e055b752-3c2f-41e0-b84d-8dd04f58a6a0,quam fringilla,nulla mollis molestie lorem quisque ut erat curabitur gravida nisi at nibh in hac habitasse platea dictumst aliquam,d131cf7a-cc95-4602-a291-f65248666e6a,12/16/2023,Sports,http://dummyimage.com/199x100.png/cc0000/ffffff
928,355e0803-edee-4db5-a4b8-b7c47da66d70,quisque,nulla elit ac nulla sed vel enim sit amet nunc viverra dapibus nulla suscipit,a7a472b5-bd54-4e94-9393-7454efcd4d6b,8/16/2023,Open World,http://dummyimage.com/207x100.png/dddddd/000000
929,1b5db769-ee70-4d52-8c7d-25856623929b,lorem integer,magna bibendum imperdiet nullam orci pede venenatis non sodales sed tincidunt eu felis fusce,8685759f-6e0b-4479-b3df-d3eb03049a5d,1/11/2023,FPS,http://dummyimage.com/208x100.png/cc0000/ffffff
930,9c821179-0dda-40bd-bef7-e5d554c7aeee,eget elit sodales,sem sed sagittis nam congue risus semper porta volutpat quam pede lobortis ligula sit amet eleifend pede libero,4536ce2c-8a73-4711-b82e-a04a3bc6b8e7,6/21/2023,Puzzle,http://dummyimage.com/119x100.png/ff4444/ffffff
931,a0159504-abad-45ce-a7f0-e80a4588a0cf,accumsan felis,a feugiat et eros vestibulum ac est lacinia nisi venenatis tristique fusce congue,c54c3719-dd60-4bb4-bdfe-92e293810e3d,7/9/2023,Open World,http://dummyimage.com/193x100.png/cc0000/ffffff
932,3ce231a3-d2ec-4243-9956-27e6dd21f2f1,nulla suspendisse,nulla sed accumsan felis ut at dolor quis odio consequat varius,e89ac0f6-c5c0-4fb4-8fb0-688e138e4768,3/8/2023,FPS,http://dummyimage.com/140x100.png/5fa2dd/ffffff
933,a4ff9f29-6385-4834-8227-148e63fb8d3c,in felis eu,suscipit ligula in lacus curabitur at ipsum ac tellus semper interdum mauris ullamcorper purus sit amet nulla quisque arcu libero,ca49ee1c-2936-4ba1-aa5d-0a0f5e6e2332,11/29/2023,Battle Royal,http://dummyimage.com/243x100.png/dddddd/000000
934,3e8fe1a2-fcb2-4c16-b3ae-046139052516,rhoncus aliquet pulvinar,metus arcu adipiscing molestie hendrerit at vulputate vitae nisl aenean,b087bfbf-09c4-46ec-899f-c9618d80b6d5,5/1/2023,Open World,http://dummyimage.com/221x100.png/ff4444/ffffff
935,8e154f93-b0be-41c4-a3f1-3e964d4349e7,sit,in purus eu magna vulputate luctus cum sociis natoque penatibus et magnis dis parturient montes nascetur,3d65cdbc-6971-49c7-a9fe-315ca1d8b758,1/14/2023,Battle Royal,http://dummyimage.com/170x100.png/cc0000/ffffff
936,04ac1d67-3f33-4f07-8d19-ba1645a776a7,risus dapibus,et eros vestibulum ac est lacinia nisi venenatis tristique fusce congue diam,b271eddc-bd4b-43fa-adce-cdeade1c7012,4/17/2023,FPS,http://dummyimage.com/227x100.png/dddddd/000000
937,1405636b-9a3f-4857-9cfc-c4d684d3a99c,luctus et,mi sit amet lobortis sapien sapien non mi integer ac neque,47f5de6f-4fc8-458f-9b2f-77e533e1ad6f,7/30/2023,Adventure,http://dummyimage.com/230x100.png/ff4444/ffffff
938,b56236fe-c417-47ce-b020-df7983a66565,vitae consectetuer eget,in leo maecenas pulvinar lobortis est phasellus sit amet erat nulla tempus,4b29f030-8eac-4ccd-86d9-a5f29fea78f8,12/31/2022,Puzzle,http://dummyimage.com/219x100.png/dddddd/000000
939,203f74d8-ef51-4064-b5e4-65c4c2b14431,in quis,proin eu mi nulla ac enim in tempor turpis nec euismod scelerisque,e324e0e1-cd48-487f-8ad3-8e143199ab30,2/24/2023,Sports,http://dummyimage.com/230x100.png/cc0000/ffffff
940,35eb535a-75db-4f4e-b382-f5f8cb76bff9,magna vulputate,neque duis bibendum morbi non quam nec dui luctus rutrum nulla tellus in sagittis dui vel nisl duis ac,07ab08c6-0b6b-47ba-a229-fd6198217cf1,10/11/2023,Moba,http://dummyimage.com/196x100.png/5fa2dd/ffffff
941,1f6c03e5-f1f0-437a-8c38-391202c4433d,integer ac,sit amet diam in magna bibendum imperdiet nullam orci pede venenatis non sodales,cc792167-eac0-4bef-8d54-5e6cfb16777e,8/14/2023,RPG,http://dummyimage.com/175x100.png/dddddd/000000
942,093f71a9-6a83-405e-9704-e0692a39694f,posuere,in magna bibendum imperdiet nullam orci pede venenatis non sodales sed tincidunt eu felis fusce,3dc325e4-5813-4245-8742-2de36a6e8f11,12/11/2023,Moba,http://dummyimage.com/194x100.png/dddddd/000000
943,be95b022-14a3-488d-8426-f45cdd25cc61,luctus et,eu nibh quisque id justo sit amet sapien dignissim vestibulum vestibulum ante ipsum primis in faucibus orci luctus et ultrices,171e7482-f18a-445b-b785-b867ef55215f,4/9/2023,Battle Royal,http://dummyimage.com/208x100.png/cc0000/ffffff
944,b8660f24-cf4f-400a-b248-4ffc1f0872d5,turpis,pede malesuada in imperdiet et commodo vulputate justo in blandit ultrices enim lorem ipsum dolor sit,bd2e5107-4a1e-4ae2-b135-7971a29b239b,11/13/2023,Moba,http://dummyimage.com/203x100.png/cc0000/ffffff
945,99f6758b-33ac-460d-a1bf-78bdef870bd0,nulla suscipit,vel nulla eget eros elementum pellentesque quisque porta volutpat erat quisque erat,f755a759-342b-4225-a196-c306c2ea69a2,3/31/2023,Puzzle,http://dummyimage.com/175x100.png/5fa2dd/ffffff
946,2f8702d4-2e24-4472-8e68-8b97dcb6b861,volutpat in congue,habitasse platea dictumst etiam faucibus cursus urna ut tellus nulla ut erat id mauris,f21b1015-7995-427c-876f-2b48affec8dc,7/17/2023,Adventure,http://dummyimage.com/159x100.png/5fa2dd/ffffff
947,2e905572-51dc-4b51-b5b7-d110e85d82bc,justo morbi ut,tellus semper interdum mauris ullamcorper purus sit amet nulla quisque arcu libero rutrum ac lobortis vel,303d1cbe-6ac8-42b7-817c-72ac709d0ae9,5/22/2023,Open World,http://dummyimage.com/223x100.png/5fa2dd/ffffff
948,d1acc619-a9c6-4085-a5fc-58de539fcfe2,nam,erat eros viverra eget congue eget semper rutrum nulla nunc purus,4df7a0bd-075a-439d-b8c4-e54852126b3b,9/7/2023,Battle Royal,http://dummyimage.com/184x100.png/cc0000/ffffff
949,fe5194d6-9ef0-4ea8-8b1a-b8a28fa05cff,diam,lacus morbi quis tortor id nulla ultrices aliquet maecenas leo odio condimentum id luctus nec molestie sed justo,48fc3599-7790-4fa1-9b40-5ca665a0e7ec,7/26/2023,Sports,http://dummyimage.com/223x100.png/dddddd/000000
950,f40fee67-395a-4d7a-bd4f-b47b40534e06,diam vitae,nibh in quis justo maecenas rhoncus aliquam lacus morbi quis tortor id nulla ultrices aliquet maecenas leo,70156947-d53b-4419-a9cb-e08fd15cf763,4/1/2023,Sports,http://dummyimage.com/130x100.png/ff4444/ffffff
951,4197ab70-0ea7-40b0-81e8-fc2996bceb32,diam erat fermentum,feugiat et eros vestibulum ac est lacinia nisi venenatis tristique fusce congue diam id ornare imperdiet sapien,3f16ff18-5022-4175-bbdf-02f62a3029ba,11/3/2023,Battle Royal,http://dummyimage.com/111x100.png/5fa2dd/ffffff
952,56abf23e-d3e2-4be2-9d0a-c246443803e7,pede justo eu,nisl aenean lectus pellentesque eget nunc donec quis orci eget orci,d3444062-4008-40cf-a6b6-c2589dc0371d,2/28/2023,Adventure,http://dummyimage.com/239x100.png/ff4444/ffffff
953,d00cc6b6-14e3-4162-ac00-ed91e7e3b383,elementum pellentesque,cras in purus eu magna vulputate luctus cum sociis natoque penatibus et magnis dis parturient montes,60d7be96-c64c-4e31-b575-59fbdb43f74c,6/5/2023,Sports,http://dummyimage.com/109x100.png/ff4444/ffffff
954,42d1213a-ab5b-4a08-8de8-2cde97817f89,quam suspendisse,lectus in quam fringilla rhoncus mauris enim leo rhoncus sed vestibulum sit amet cursus,4fe6ff2f-3387-4271-a9a2-0ffc2c5f2dba,7/30/2023,Adventure,http://dummyimage.com/228x100.png/dddddd/000000
955,c8ba4468-7e5f-48ee-8139-4efb44c470ce,ipsum,suscipit a feugiat et eros vestibulum ac est lacinia nisi venenatis tristique fusce congue,1d95744d-6e3f-42c4-8a54-4ed33edb7a74,11/4/2023,Sports,http://dummyimage.com/242x100.png/dddddd/000000
956,e70ee438-ad33-4d42-8bdb-7b602e2445d1,aliquam erat,etiam pretium iaculis justo in hac habitasse platea dictumst etiam faucibus cursus urna ut,63bf9288-beda-4d45-bdfa-e50627f07c79,10/14/2023,Open World,http://dummyimage.com/232x100.png/cc0000/ffffff
957,927a7c5b-0b64-499d-aba5-5ca63308ec52,tortor duis mattis,felis fusce posuere felis sed lacus morbi sem mauris laoreet ut rhoncus aliquet pulvinar sed nisl nunc,07132640-6e2e-4c8c-8b15-0dd6d41999a9,1/3/2023,FPS,http://dummyimage.com/150x100.png/5fa2dd/ffffff
958,6101b791-09a4-4912-983a-a525d69bf2d3,non,nullam porttitor lacus at turpis donec posuere metus vitae ipsum aliquam non mauris morbi non lectus aliquam sit,cc5ccdd6-94dc-4425-b165-118af3a34b09,9/15/2023,Horor,http://dummyimage.com/143x100.png/5fa2dd/ffffff
959,b4322658-abc7-4d87-a86a-9ce2e714802b,dui maecenas tristique,at turpis a pede posuere nonummy integer non velit donec diam neque vestibulum,07e24efd-73e7-4a97-9980-e7e1a3884d2e,12/13/2023,Open World,http://dummyimage.com/199x100.png/5fa2dd/ffffff
960,efa958f2-0ddc-4ee0-b863-03dc3fc82998,quam,porttitor lorem id ligula suspendisse ornare consequat lectus in est risus auctor sed tristique in tempus sit amet sem fusce,ef7e4187-b882-4811-a424-9aeff77021e5,11/16/2023,Sports,http://dummyimage.com/166x100.png/ff4444/ffffff
961,b1df6c39-78ae-4ea5-9ea8-517cf809447c,etiam,tellus semper interdum mauris ullamcorper purus sit amet nulla quisque,c308751c-b7c9-4b21-832c-ae42a09b60af,4/27/2023,Horor,http://dummyimage.com/205x100.png/dddddd/000000
962,8c29048d-57b5-4ac6-8091-e2d496d6f2f8,hac habitasse,augue vestibulum ante ipsum primis in faucibus orci luctus et ultrices posuere cubilia curae donec pharetra magna,ed4e530e-297d-4b01-b060-6fc1aa08c14f,6/17/2023,Horor,http://dummyimage.com/109x100.png/cc0000/ffffff
963,06fa68cc-9339-4f23-90fb-bb27924bfd47,at nunc commodo,varius integer ac leo pellentesque ultrices mattis odio donec vitae,615a45ab-a379-4fba-bb20-476dc0ea34f7,8/13/2023,Horor,http://dummyimage.com/139x100.png/cc0000/ffffff
964,c739313e-ada6-4525-a129-d7b158e3fea5,et ultrices posuere,vitae nisl aenean lectus pellentesque eget nunc donec quis orci eget orci vehicula condimentum curabitur in,15861f84-dfb9-445b-9dd3-c002ad56c163,4/27/2023,Open World,http://dummyimage.com/128x100.png/dddddd/000000
965,2c79880a-56cf-438c-97fb-208d9d03ddb5,leo rhoncus sed,ultrices posuere cubilia curae mauris viverra diam vitae quam suspendisse potenti nullam porttitor lacus at turpis donec posuere metus,d0ecac4a-14c6-4ff0-95c6-12c0371af880,1/12/2023,Horor,http://dummyimage.com/132x100.png/ff4444/ffffff
966,30153e4a-30db-4589-8580-43a232b9bb81,nisi,ut blandit non interdum in ante vestibulum ante ipsum primis,26f61732-6f7d-46d4-960d-73375ebf0252,11/27/2023,Battle Royal,http://dummyimage.com/230x100.png/cc0000/ffffff
967,b65f29f4-bd9e-40f5-842b-cb2447cefefd,at turpis donec,in lacus curabitur at ipsum ac tellus semper interdum mauris ullamcorper purus sit amet nulla quisque,1559205f-66a5-405b-a722-8a7204d65ae8,3/13/2023,Horor,http://dummyimage.com/229x100.png/ff4444/ffffff
968,9e9be672-ca32-46f2-90cc-454e9b05fceb,suspendisse potenti in,elit ac nulla sed vel enim sit amet nunc viverra dapibus nulla,91be3343-1ec6-48f8-b94f-fe9cccc29503,10/6/2023,RPG,http://dummyimage.com/239x100.png/5fa2dd/ffffff
969,6ea4ae14-9932-47f7-9c42-653448ce97f7,potenti cras in,metus arcu adipiscing molestie hendrerit at vulputate vitae nisl aenean lectus pellentesque eget nunc donec quis orci,1b687ee7-ffbf-4386-9519-29e735327c9b,7/25/2023,Battle Royal,http://dummyimage.com/203x100.png/5fa2dd/ffffff
970,e46584a1-5e8b-4830-b55b-5c193f79b5ed,mauris viverra,magna vestibulum aliquet ultrices erat tortor sollicitudin mi sit amet lobortis sapien sapien,ad7785c6-f5dd-4781-8b74-292fc36ee98f,8/20/2023,Puzzle,http://dummyimage.com/195x100.png/ff4444/ffffff
971,9b9344ad-5b18-4ae5-a003-1ab7bd16beda,habitasse,lobortis convallis tortor risus dapibus augue vel accumsan tellus nisi eu orci mauris,36fe90e5-8d80-42df-97af-afcd1e8cda1b,9/21/2023,Moba,http://dummyimage.com/145x100.png/ff4444/ffffff
972,cf30f314-0034-4a35-b39d-7a0d47711273,praesent blandit,nulla elit ac nulla sed vel enim sit amet nunc viverra dapibus nulla suscipit ligula in lacus curabitur at,0a920d67-2fda-4d54-a3eb-721ae7e78ef4,4/27/2023,Sports,http://dummyimage.com/161x100.png/cc0000/ffffff
973,53086d39-1fa1-4e20-b15d-26052fa52d06,ac diam cras,proin eu mi nulla ac enim in tempor turpis nec euismod scelerisque quam turpis adipiscing lorem vitae mattis nibh,d4f138f8-9d69-4c48-b1a7-273ff558069e,3/28/2023,Puzzle,http://dummyimage.com/142x100.png/cc0000/ffffff
974,0758ea61-9b31-4a50-9966-8e12635d50a3,nec,ut nulla sed accumsan felis ut at dolor quis odio consequat varius integer ac leo pellentesque ultrices,9b02a045-6f94-4f20-8201-78523ae54a37,7/17/2023,FPS,http://dummyimage.com/142x100.png/ff4444/ffffff
975,983775c0-8366-4b9a-b4c7-0c23447cd631,urna,enim in tempor turpis nec euismod scelerisque quam turpis adipiscing lorem vitae mattis nibh ligula nec sem,127d7470-00ec-4aab-9cd6-b6e3996d46a8,5/21/2023,Sports,http://dummyimage.com/133x100.png/ff4444/ffffff
976,70d7dbe3-0277-4961-8c1f-7d9440225e5c,curae mauris,nec nisi vulputate nonummy maecenas tincidunt lacus at velit vivamus vel,1c831cbe-8862-4d3a-80bd-f5e31decf14c,12/25/2022,Puzzle,http://dummyimage.com/242x100.png/ff4444/ffffff
977,94e5308a-d8da-4faa-8c43-82a9c6207ce1,turpis sed ante,et ultrices posuere cubilia curae nulla dapibus dolor vel est donec odio,8a96f6d3-ee8e-4c84-8151-94ef79ce24d2,2/18/2023,Open World,http://dummyimage.com/127x100.png/5fa2dd/ffffff
978,669d4610-f1a2-4968-b323-c0a5bb2ed124,non,commodo vulputate justo in blandit ultrices enim lorem ipsum dolor sit amet consectetuer adipiscing elit,6215f237-0293-4f39-89ab-f57107501540,1/29/2023,Battle Royal,http://dummyimage.com/238x100.png/5fa2dd/ffffff
979,da38e085-c600-44ce-a55c-7911225d6aa2,nunc,ac enim in tempor turpis nec euismod scelerisque quam turpis adipiscing lorem vitae mattis nibh,53e47708-9f46-445f-8ee1-0cf4617d489e,10/8/2023,Moba,http://dummyimage.com/161x100.png/ff4444/ffffff
980,65be764a-be3c-4875-b542-745a1242da40,nec sem,id turpis integer aliquet massa id lobortis convallis tortor risus dapibus augue vel accumsan tellus nisi eu orci mauris,fc4d32dd-56b2-44b7-9f06-02b1a80182db,7/20/2023,Horor,http://dummyimage.com/144x100.png/5fa2dd/ffffff
981,2e3356c2-1bac-4ade-a701-1cfbc4077c61,lorem quisque ut,ut massa quis augue luctus tincidunt nulla mollis molestie lorem quisque ut erat curabitur gravida nisi,b9151e39-b553-4965-a978-242f13f7e0da,11/2/2023,Open World,http://dummyimage.com/186x100.png/dddddd/000000
982,bdad6201-b4bd-4d30-a2a8-dab30b3a2836,donec diam neque,diam vitae quam suspendisse potenti nullam porttitor lacus at turpis donec,5c061248-25ec-4782-b805-1826c393ec4e,10/3/2023,Battle Royal,http://dummyimage.com/235x100.png/5fa2dd/ffffff
983,a51d07b9-44c0-4a41-93ce-610731220d95,duis aliquam,nisi vulputate nonummy maecenas tincidunt lacus at velit vivamus vel nulla eget eros elementum pellentesque quisque porta volutpat erat quisque,fd8d90a5-cb47-4346-aeea-1d39bd35af21,9/28/2023,Moba,http://dummyimage.com/208x100.png/cc0000/ffffff
984,b50da790-f771-4b0b-9521-c6036beec312,justo pellentesque viverra,eu sapien cursus vestibulum proin eu mi nulla ac enim in tempor turpis nec euismod scelerisque quam turpis adipiscing,fc487140-8406-47eb-829c-6b91a44b06a2,4/6/2023,Puzzle,http://dummyimage.com/201x100.png/5fa2dd/ffffff
985,9eef0345-3c33-493b-a5ea-be8d96f9d1a0,pharetra magna ac,sed vestibulum sit amet cursus id turpis integer aliquet massa id lobortis convallis tortor risus dapibus augue vel accumsan,62e7f3dc-bd69-46a0-89b6-e5f8ea98d495,10/8/2023,Puzzle,http://dummyimage.com/217x100.png/cc0000/ffffff
986,5e377a8a-7744-4209-8d48-c2fc4f5bf641,vestibulum,eu tincidunt in leo maecenas pulvinar lobortis est phasellus sit amet erat nulla tempus,2eda7fb1-8d1f-455f-bbf3-fae5335b6bd9,4/2/2023,Horor,http://dummyimage.com/168x100.png/cc0000/ffffff
987,db0101c3-e921-4b69-a423-6e99a9beb82b,congue diam id,molestie hendrerit at vulputate vitae nisl aenean lectus pellentesque eget nunc donec quis orci eget,0ed014ba-0182-4962-96b1-88fa4db6d393,6/25/2023,FPS,http://dummyimage.com/174x100.png/cc0000/ffffff
988,ea1c712c-f436-4b23-aea4-aa5b57e22cad,mauris sit,a nibh in quis justo maecenas rhoncus aliquam lacus morbi quis tortor id nulla ultrices,5c34d35a-07d9-4676-8f66-c05b03309531,6/4/2023,Horor,http://dummyimage.com/176x100.png/dddddd/000000
989,7c422025-fd80-4320-b2da-2f5bc8ac00da,morbi vel lectus,ut massa quis augue luctus tincidunt nulla mollis molestie lorem quisque ut erat curabitur gravida nisi,3d20dbb4-a0e9-4e9d-87bb-889ddc452ed0,8/27/2023,Open World,http://dummyimage.com/238x100.png/cc0000/ffffff
990,75fc18ad-66b9-4ec0-bb38-30e7daef61bf,porttitor lorem id,felis sed interdum venenatis turpis enim blandit mi in porttitor pede justo eu massa donec dapibus,6793d410-9455-4a8f-b01f-d07af9461323,2/8/2023,Adventure,http://dummyimage.com/135x100.png/cc0000/ffffff
991,c2389416-9bf4-4a9b-809f-421757bd369a,mattis,ut odio cras mi pede malesuada in imperdiet et commodo vulputate justo in blandit ultrices enim lorem,2d85d6e1-9184-4dda-b873-0e89d8df6ded,2/16/2023,Puzzle,http://dummyimage.com/180x100.png/cc0000/ffffff
992,2a779645-b165-4f39-aefe-922daa4ab86e,mus,tempor turpis nec euismod scelerisque quam turpis adipiscing lorem vitae mattis nibh,5669991e-48b5-4f6f-966c-0e5557ef3dc8,3/28/2023,Horor,http://dummyimage.com/238x100.png/5fa2dd/ffffff
993,7ee557fc-ebe2-4502-95ee-ff7920602252,curabitur gravida,facilisi cras non velit nec nisi vulputate nonummy maecenas tincidunt lacus at velit vivamus vel nulla eget,45c0e08c-ea27-48df-a7f5-64667be8334e,9/9/2023,Horor,http://dummyimage.com/195x100.png/ff4444/ffffff
994,f86ba177-fd5d-487b-a312-833c4a3e0478,eu interdum eu,vivamus tortor duis mattis egestas metus aenean fermentum donec ut mauris eget massa tempor convallis,e5e38675-9e35-433d-bbf5-541e5551c766,11/16/2023,Sports,http://dummyimage.com/103x100.png/dddddd/000000
995,9ede6174-a826-4a2a-b1c6-82cca1e1eb7f,risus praesent lectus,pede justo lacinia eget tincidunt eget tempus vel pede morbi porttitor,0fa52a7a-79dd-4f69-939c-154d9176c657,7/20/2023,Horor,http://dummyimage.com/126x100.png/cc0000/ffffff
996,0eacb999-665a-4abe-b3c7-27d41ce7c118,nisi,consequat metus sapien ut nunc vestibulum ante ipsum primis in faucibus orci luctus et ultrices posuere cubilia curae,7e41d164-e940-4a22-b229-e202e27af244,7/23/2023,RPG,http://dummyimage.com/226x100.png/cc0000/ffffff
997,fce88e4e-3a3a-47f5-82f8-86c52930faf1,sociis natoque penatibus,rutrum rutrum neque aenean auctor gravida sem praesent id massa id nisl,40c2e3ea-a880-4ff0-bbcc-4a93430a1d1c,9/25/2023,RPG,http://dummyimage.com/208x100.png/ff4444/ffffff
998,1b5358fc-f192-4a3f-be15-d6ee0a5dc7c1,odio,mattis egestas metus aenean fermentum donec ut mauris eget massa tempor convallis nulla neque libero convallis eget eleifend luctus,590d45d8-52d5-4904-8215-90c77ce949cf,1/28/2023,Battle Royal,http://dummyimage.com/134x100.png/ff4444/ffffff
999,16dc3428-c629-4a91-871b-7c02eb339ab9,sem praesent id,dapibus dolor vel est donec odio justo sollicitudin ut suscipit a feugiat et eros vestibulum ac,f45850c4-2746-429b-a47c-462161f2289c,2/16/2023,Moba,http://dummyimage.com/203x100.png/cc0000/ffffff
1000,227e44da-45d4-425e-92f5-3da0229ee514,diam neque vestibulum,enim in tempor turpis nec euismod scelerisque quam turpis adipiscing lorem vitae,0b544b82-e48d-4f43-b5a1-ba703a1d6064,1/14/2023,Open World,http://dummyimage.com/189x100.png/dddddd/000000
1001,fa9d8eb0-2c9c-420c-99f1-358c0804e0aa,amet consectetuer adipiscing,nulla quisque arcu libero rutrum ac lobortis vel dapibus at,09c2331d-16f6-4a01-ad08-f1a26af71fd5,10/16/2023,Adventure,http://dummyimage.com/193x100.png/cc0000/ffffff
1002,bc69f818-33ac-4d60-8f6a-567a575b48e3,in faucibus,viverra diam vitae quam suspendisse potenti nullam porttitor lacus at turpis donec posuere metus vitae ipsum aliquam,9d9af3f1-1ec9-4c0d-b4d9-aacf86c6ef05,12/8/2023,Open World,http://dummyimage.com/223x100.png/dddddd/000000
1003,6adcb49c-e4a6-49f5-ad21-505b40e72886,tellus,est risus auctor sed tristique in tempus sit amet sem fusce consequat nulla nisl nunc nisl,a29fb839-675e-4a72-a96e-c4cd829d4667,4/30/2023,Battle Royal,http://dummyimage.com/234x100.png/cc0000/ffffff
1004,92e85585-a2a1-4754-9783-b4b74c4e30c5,lacus,vivamus vestibulum sagittis sapien cum sociis natoque penatibus et magnis dis parturient montes nascetur ridiculus,c7223f7e-5072-4749-9e5f-6144e4d5ed2c,6/14/2023,RPG,http://dummyimage.com/231x100.png/dddddd/000000
1005,b5782426-f6b6-4c70-9f65-1b35de0ab263,nulla mollis,pharetra magna vestibulum aliquet ultrices erat tortor sollicitudin mi sit amet lobortis sapien sapien non mi integer ac,c7d2b146-3e7c-45db-a484-dbc30c7a3af1,2/18/2023,Moba,http://dummyimage.com/221x100.png/5fa2dd/ffffff
1006,bb524daf-6dc2-43e2-a78c-5cc837ae075d,vitae ipsum aliquam,vel accumsan tellus nisi eu orci mauris lacinia sapien quis,7461a99c-05dd-4ac4-820e-74f210a67256,8/8/2023,Open World,http://dummyimage.com/201x100.png/dddddd/000000
1007,c76f4875-580c-4150-9b49-3efb85b549ff,ipsum integer,ut tellus nulla ut erat id mauris vulputate elementum nullam varius nulla facilisi cras non velit nec nisi vulputate nonummy,66bf8a64-a44e-451d-be53-71f993322bb7,11/28/2023,Battle Royal,http://dummyimage.com/161x100.png/dddddd/000000
1008,2231f21c-7354-4e00-9f37-5dd14889f159,iaculis justo in,aliquam quis turpis eget elit sodales scelerisque mauris sit amet eros suspendisse accumsan tortor quis turpis sed ante vivamus tortor,9b144b0d-3cea-453f-86f6-2a4e1c4995dc,8/8/2023,Open World,http://dummyimage.com/248x100.png/ff4444/ffffff
1009,8559b265-0e38-4961-a659-44554017b600,at diam,proin eu mi nulla ac enim in tempor turpis nec euismod scelerisque quam turpis adipiscing lorem vitae mattis,bb5fa3cb-4f85-4b90-8156-7d5b2ebe4f96,1/6/2023,RPG,http://dummyimage.com/151x100.png/5fa2dd/ffffff
1010,f9fe91a2-ea6a-4a5e-897b-fa802037b1ab,massa,aliquam augue quam sollicitudin vitae consectetuer eget rutrum at lorem integer tincidunt ante vel ipsum praesent blandit lacinia erat,eae4e273-5c52-41e1-84f5-36302a713924,8/13/2023,RPG,http://dummyimage.com/155x100.png/ff4444/ffffff
1011,80ad322f-1c31-4b51-8828-2bfaf9e59a26,sed justo,rutrum nulla nunc purus phasellus in felis donec semper sapien a libero nam dui,b8f79bb5-0e73-4b75-bd11-edfd7d3aee10,6/4/2023,Moba,http://dummyimage.com/138x100.png/cc0000/ffffff
1012,d622ebf2-6780-46ec-a459-6fb4e7e971f2,penatibus et,nascetur ridiculus mus etiam vel augue vestibulum rutrum rutrum neque aenean auctor gravida sem,71e2541e-1544-4984-a5fb-9b7055b27e13,2/2/2023,Puzzle,http://dummyimage.com/151x100.png/ff4444/ffffff
1013,f7a6c3ec-2fc8-408c-8188-d7e3b0f7e3f0,mus,in hac habitasse platea dictumst morbi vestibulum velit id pretium iaculis diam erat fermentum,48ed5267-eb3d-450e-b16e-694b18096906,4/2/2023,Open World,http://dummyimage.com/250x100.png/5fa2dd/ffffff
1014,3dc90683-adb3-40a0-9db1-689d24fc5063,orci,curabitur convallis duis consequat dui nec nisi volutpat eleifend donec ut dolor morbi vel,baeb88ee-beb2-46ae-b710-c44a85402edb,10/31/2023,Sports,http://dummyimage.com/208x100.png/5fa2dd/ffffff
1015,9079af1f-41fa-4a52-ac43-482da57bad49,maecenas,viverra pede ac diam cras pellentesque volutpat dui maecenas tristique est et tempus semper est quam pharetra magna ac consequat,7868205a-4d17-4f98-acea-3aaa5d2541cf,8/15/2023,Puzzle,http://dummyimage.com/150x100.png/ff4444/ffffff
1016,89fb631a-b135-4384-922c-117893a5c3cc,ante,adipiscing elit proin interdum mauris non ligula pellentesque ultrices phasellus id sapien,bc110a8e-2f04-4ca5-b293-45d3728546a9,2/11/2023,RPG,http://dummyimage.com/130x100.png/5fa2dd/ffffff
1017,dce720bf-96d1-4dfc-b8a2-76b3875b13eb,sollicitudin,pede justo eu massa donec dapibus duis at velit eu est congue elementum in hac,4b20eb16-fae5-401f-b240-6646d2a18118,7/24/2023,Adventure,http://dummyimage.com/207x100.png/dddddd/000000
1018,f181f375-5ad0-4220-8bca-7e3b0b3f52a7,interdum,nisi eu orci mauris lacinia sapien quis libero nullam sit amet turpis elementum ligula,b8553b9c-39b8-4f7e-8952-457f2b4fc053,8/12/2023,Moba,http://dummyimage.com/184x100.png/cc0000/ffffff
1019,fc137e53-0fea-4935-929e-780faffbea97,dui vel,proin at turpis a pede posuere nonummy integer non velit donec diam neque vestibulum eget vulputate ut,5555e504-33ae-4b5d-98b5-91ed811d5ed3,9/23/2023,Battle Royal,http://dummyimage.com/206x100.png/5fa2dd/ffffff
