id_project,project_id,project_name,project_desc,user_id,deadline,game_type,imgUrl
612,c4c552d5-9ce4-4f4c-8678-bc6fc680408b,ut nulla,lobortis sapien sapien non mi integer ac neque duis bibendum morbi non quam nec dui luctus rutrum nulla,eae62aa5-d1fc-4ffe-916b-e780c3032bc1,12/4/2023,RPG,http://dummyimage.com/242x100.png/5fa2dd/ffffff
613,c1958640-17c5-43a3-8cfd-03e9da36b78b,justo morbi,diam vitae quam suspendisse potenti nullam porttitor lacus at turpis donec posuere metus vitae ipsum aliquam non mauris morbi non,aef7c8f0-5f85-44e8-bd8d-46fc74ec3cbc,5/30/2023,Horor,http://dummyimage.com/129x100.png/dddddd/000000
614,391ad8fb-b10c-42c5-9d27-acb6f2dcf224,et eros vestibulum,curae duis faucibus accumsan odio curabitur convallis duis consequat dui nec nisi volutpat eleifend donec ut dolor morbi vel lectus,a338804b-ddc0-482f-bfb0-1ccc6bf1bf7c,4/27/2023,RPG,http://dummyimage.com/155x100.png/ff4444/ffffff
615,411a2936-8127-4913-8026-57d034bf113f,et ultrices posuere,amet nulla quisque arcu libero rutrum ac lobortis vel dapibus at diam nam tristique tortor eu pede,dcc64bb2-2641-4b54-94d3-d708d29d0b9e,11/29/2023,Adventure,http://dummyimage.com/147x100.png/5fa2dd/ffffff
616,6e837225-c464-4218-b9ff-a62784124902,magna at nunc,lacinia nisi venenatis tristique fusce congue diam id ornare imperdiet sapien urna pretium nisl ut volutpat,c9a55cc2-7454-4172-8cb0-f4951e86613f,8/23/2023,Horor,http://dummyimage.com/149x100.png/cc0000/ffffff
617,d32802fa-7c42-4078-9cfa-19ccd8c9ae7a,lobortis vel,lacinia sapien quis libero nullam sit amet turpis elementum ligula vehicula consequat morbi a ipsum integer,acd14853-0aef-4b92-bc0c-9af7c143e8ce,3/12/2023,Battle Royal,http://dummyimage.com/165x100.png/dddddd/000000
618,cf470837-fdcf-4c4d-bd34-23e1f8f6d7b0,dapibus nulla,tortor id nulla ultrices aliquet maecenas leo odio condimentum id luctus,e91af4f0-632d-4560-bb19-1307299cf389,7/18/2023,Open World,http://dummyimage.com/204x100.png/cc0000/ffffff
619,e11affa0-3293-4842-80b3-28be1783d9b8,felis,nullam porttitor lacus at turpis donec posuere metus vitae ipsum aliquam non mauris morbi non lectus aliquam sit amet diam,ee9fafaf-3ede-4b9b-9172-fa12cd1bc836,3/5/2023,RPG,http://dummyimage.com/203x100.png/ff4444/ffffff
620,e6ae7c11-12f3-4724-abcc-fe47758b4a4f,ligula,laoreet ut rhoncus aliquet pulvinar sed nisl nunc rhoncus dui vel sem sed sagittis nam congue risus semper,6430c632-6e05-47d8-9de6-c153d94c7296,8/24/2023,RPG,http://dummyimage.com/108x100.png/ff4444/ffffff
621,72245624-59bb-4042-838f-19f5b4fec300,semper,nec nisi vulputate nonummy maecenas tincidunt lacus at velit vivamus vel nulla eget eros elementum pellentesque quisque,06030bf6-9e36-4a8d-9734-9063d9d6b25b,5/18/2023,Puzzle,http://dummyimage.com/104x100.png/5fa2dd/ffffff
622,9f838ca2-f50d-46ec-869c-42fd2c76299a,auctor sed,interdum in ante vestibulum ante ipsum primis in faucibus orci,747f5ee5-598b-4fd6-904e-a14bb6d13b44,7/16/2023,RPG,http://dummyimage.com/170x100.png/dddddd/000000
623,6dc03efa-ce7b-4b80-bb27-b84ba1b73f66,morbi,praesent blandit lacinia erat vestibulum sed magna at nunc commodo placerat praesent blandit nam,4d6f1119-4629-4de9-82a3-1cc508b5a990,10/27/2023,Sports,http://dummyimage.com/177x100.png/5fa2dd/ffffff
624,008dc819-f209-47f4-b907-7e4fe0ee0c89,tellus semper,varius ut blandit non interdum in ante vestibulum ante ipsum primis in faucibus orci luctus et ultrices posuere cubilia,65d3264a-1fc6-422d-a99e-f88f0589a627,7/5/2023,Open World,http://dummyimage.com/138x100.png/ff4444/ffffff
625,84614f14-cae9-40ff-a365-064c31ab630f,volutpat quam,montes nascetur ridiculus mus vivamus vestibulum sagittis sapien cum sociis natoque penatibus et magnis dis,9de98e17-410d-46f4-bfc7-7bb663bcda5e,8/4/2023,Open World,http://dummyimage.com/169x100.png/ff4444/ffffff
626,1d92b6d7-0d33-4c8d-a39a-a3b9a74cc6a2,vel pede,velit vivamus vel nulla eget eros elementum pellentesque quisque porta volutpat erat quisque erat eros viverra eget congue,281fe33b-5281-484f-8e46-9b6d8b76a5ff,4/1/2023,Puzzle,http://dummyimage.com/159x100.png/dddddd/000000
627,d6102644-68fa-4aaa-ba48-836899a2f4ed,sociis natoque,nulla integer pede justo lacinia eget tincidunt eget tempus vel pede morbi porttitor lorem id ligula suspendisse,5cff7f9f-1d39-42c2-b330-9d13db5bd5de,3/8/2023,Horor,http://dummyimage.com/197x100.png/cc0000/ffffff
628,316aea45-b152-47f9-887d-b33a7e8f7ba8,viverra dapibus nulla,purus aliquet at feugiat non pretium quis lectus suspendisse potenti in eleifend quam a odio in hac habitasse platea,0933e6b8-6215-49ae-99ba-7d84bfa136c5,8/2/2023,Horor,http://dummyimage.com/230x100.png/dddddd/000000
629,0a423726-1fe8-4b20-94e8-fae2460a2e5d,in hac,potenti cras in purus eu magna vulputate luctus cum sociis natoque penatibus et magnis dis,64b7a573-7c47-41fd-8456-efe4cfc88249,2/4/2023,RPG,http://dummyimage.com/102x100.png/dddddd/000000
630,40c38295-607c-4427-b0d3-4964fba497ea,etiam faucibus cursus,in consequat ut nulla sed accumsan felis ut at dolor quis odio consequat varius integer ac leo,ab181fbc-b290-4764-b65d-4467a47cf2da,6/29/2023,Adventure,http://dummyimage.com/122x100.png/dddddd/000000
631,f3d57844-d778-43ed-8051-d16bd3f51ba1,et ultrices posuere,turpis integer aliquet massa id lobortis convallis tortor risus dapibus,9cae4840-184b-4893-9aee-26530aaa17f5,4/5/2023,RPG,http://dummyimage.com/132x100.png/5fa2dd/ffffff
632,614744ed-954d-45e6-865a-cf7392388f73,ipsum,dictumst aliquam augue quam sollicitudin vitae consectetuer eget rutrum at,f9f49e05-46be-4771-9cde-897124adcd92,3/14/2023,Sports,http://dummyimage.com/130x100.png/dddddd/000000
633,2b73718d-122b-42cf-8ef6-576640e6649b,orci,molestie hendrerit at vulputate vitae nisl aenean lectus pellentesque eget nunc donec quis orci eget orci vehicula condimentum,75f30cd3-7dbc-408a-959d-94f134260e23,4/3/2023,Horor,http://dummyimage.com/111x100.png/ff4444/ffffff
634,9be0dc09-6b61-4297-a50a-c8f4bf3b27fe,luctus nec,aliquam erat volutpat in congue etiam justo etiam pretium iaculis justo in hac habitasse platea dictumst,ca69d2f5-f113-4d26-8b60-ef4f39364931,5/14/2023,Open World,http://dummyimage.com/249x100.png/5fa2dd/ffffff
635,417f8955-6feb-4203-8c0f-3d76bb66e339,sit amet justo,morbi porttitor lorem id ligula suspendisse ornare consequat lectus in est risus auctor sed tristique in tempus sit,62d4f36b-83a5-4d5a-b59d-ce8f9c3843ab,7/7/2023,RPG,http://dummyimage.com/219x100.png/ff4444/ffffff
636,0ab7afe2-7064-40b0-b3a6-e162995ced14,mauris enim leo,rhoncus sed vestibulum sit amet cursus id turpis integer aliquet massa id lobortis,e831241c-dea9-452f-9865-6d01d017ddc7,12/29/2022,Puzzle,http://dummyimage.com/246x100.png/ff4444/ffffff
637,c9d81426-1754-4a6b-9a1f-d7273bfdfe3e,quis,ipsum primis in faucibus orci luctus et ultrices posuere cubilia curae duis faucibus,19f7b1dc-8782-4f5c-9cfd-b5fb49ca05e9,7/4/2023,Adventure,http://dummyimage.com/126x100.png/dddddd/000000
638,6b9f5250-1887-4802-851d-0131c39ba5d3,nec molestie,sapien cursus vestibulum proin eu mi nulla ac enim in tempor turpis nec euismod scelerisque,1a2dc650-5435-4c77-b284-4c7e9d5f8202,12/4/2023,FPS,http://dummyimage.com/167x100.png/dddddd/000000
639,4e2d3b50-a650-4520-9f37-87018d57bc2d,semper porta,sit amet consectetuer adipiscing elit proin risus praesent lectus vestibulum quam sapien,2dbadd5e-41bc-4fde-b12f-ba10625b6dbc,8/19/2023,Sports,http://dummyimage.com/195x100.png/5fa2dd/ffffff
640,8e30660e-ef32-4e94-b836-3f63f57fc62b,vulputate,suspendisse potenti cras in purus eu magna vulputate luctus cum sociis natoque penatibus et magnis dis parturient montes nascetur,16daf629-382e-48de-8773-51346cd1104b,12/8/2023,Puzzle,http://dummyimage.com/133x100.png/cc0000/ffffff
641,d04ca7ec-c0bb-41f0-a0ac-ae016a40a7ab,laoreet ut rhoncus,orci luctus et ultrices posuere cubilia curae donec pharetra magna,5db73011-4dab-4455-957e-bf80e31e1c6c,2/10/2023,Battle Royal,http://dummyimage.com/208x100.png/5fa2dd/ffffff
642,26313cf3-dc08-48fe-b838-a7c7f383652e,ante ipsum,phasellus in felis donec semper sapien a libero nam dui proin leo odio porttitor id consequat in,063fbcca-9854-4992-9e9e-2c7d28e71cd8,9/24/2023,Horor,http://dummyimage.com/206x100.png/ff4444/ffffff
643,5f4d0817-b03b-4df3-b972-2ea08381dc3b,et eros,integer tincidunt ante vel ipsum praesent blandit lacinia erat vestibulum sed magna at nunc commodo placerat praesent,fadd8b5a-e5c8-4a83-b952-c280c97846b5,2/20/2023,Horor,http://dummyimage.com/175x100.png/5fa2dd/ffffff
644,eb89c9ee-1b3b-4c01-ab33-0a9313bcb2fa,eu tincidunt,donec vitae nisi nam ultrices libero non mattis pulvinar nulla pede ullamcorper,b1611881-1808-4211-8a0b-2539b19624b0,6/17/2023,Sports,http://dummyimage.com/170x100.png/5fa2dd/ffffff
645,2d65bb3b-c081-4acf-b436-841e63e0f244,interdum,sapien ut nunc vestibulum ante ipsum primis in faucibus orci luctus et,b486231e-57e7-4c99-b822-00cc780b304f,3/6/2023,RPG,http://dummyimage.com/162x100.png/5fa2dd/ffffff
646,29d1f3bd-5ef8-4835-b4da-e3bfa8bbc542,eu magna,vel pede morbi porttitor lorem id ligula suspendisse ornare consequat lectus in est risus auctor sed tristique in,d93495c1-8cbb-4592-acec-5a026814429a,9/25/2023,Puzzle,http://dummyimage.com/102x100.png/ff4444/ffffff
647,db2bd6f0-88cf-464e-8e55-298c70daed61,lorem integer,pulvinar lobortis est phasellus sit amet erat nulla tempus vivamus in felis eu sapien,da4c1733-6c55-4f12-9ff2-52a319e5acef,5/17/2023,Horor,http://dummyimage.com/156x100.png/cc0000/ffffff
648,b477057f-c05f-4219-ad4f-4ac6d13966ea,suspendisse,in hac habitasse platea dictumst maecenas ut massa quis augue luctus tincidunt nulla mollis molestie lorem quisque ut erat,7521c7c3-7def-4a35-9e47-e32a9479b494,12/7/2023,Open World,http://dummyimage.com/161x100.png/dddddd/000000
649,fbe2448e-9bd8-49b5-ae4e-0a6a35c307bf,libero quis,accumsan tellus nisi eu orci mauris lacinia sapien quis libero nullam sit amet turpis elementum ligula vehicula,c37ec40b-d7f3-438b-a2bb-a8fb49bfc925,8/1/2023,Sports,http://dummyimage.com/185x100.png/cc0000/ffffff
650,b86de1ad-b3e9-4d74-aef1-8e3665d65984,auctor,varius ut blandit non interdum in ante vestibulum ante ipsum primis in faucibus orci luctus et ultrices,c50bda8a-b622-4864-8230-b092f959fabf,8/19/2023,FPS,http://dummyimage.com/144x100.png/cc0000/ffffff
651,b18b5e0c-a7fa-4b68-ad7e-7a50684109be,nisi volutpat eleifend,erat eros viverra eget congue eget semper rutrum nulla nunc purus phasellus in felis donec semper,3a66fbf7-d37e-4b4a-b5e7-6da3adba17cd,10/7/2023,Moba,http://dummyimage.com/223x100.png/5fa2dd/ffffff
652,7082b451-7ce7-4483-a5d5-19093b6e8130,donec vitae,pellentesque ultrices mattis odio donec vitae nisi nam ultrices libero non mattis pulvinar nulla pede ullamcorper augue,1ef50c41-8e96-4fb4-8a78-245cd706cf0b,7/23/2023,Puzzle,http://dummyimage.com/203x100.png/dddddd/000000
653,c088d8ee-b8b5-4e89-80d6-de4e2e515d5a,et ultrices posuere,ut nulla sed accumsan felis ut at dolor quis odio consequat,6d2d0736-337c-431c-a80b-31ebbe3bc1df,2/24/2023,FPS,http://dummyimage.com/226x100.png/5fa2dd/ffffff
654,9d9b6293-8228-47d6-93fa-92f113546696,non velit nec,volutpat sapien arcu sed augue aliquam erat volutpat in congue etiam justo etiam pretium iaculis justo in hac,129350a1-a151-4648-a989-fefc95da5aaa,1/19/2023,RPG,http://dummyimage.com/174x100.png/5fa2dd/ffffff
655,61c98024-a8ba-409d-8b36-588858bd127b,morbi sem,in quam fringilla rhoncus mauris enim leo rhoncus sed vestibulum sit amet cursus id,8703f6e7-b791-40e9-bc43-8d230e92400d,9/6/2023,Sports,http://dummyimage.com/180x100.png/ff4444/ffffff
656,eef8a209-562b-4a1d-9e84-3f4df1aba306,aliquet maecenas,donec diam neque vestibulum eget vulputate ut ultrices vel augue vestibulum ante ipsum primis in faucibus orci luctus et ultrices,14f326bc-5b56-4d57-8aac-808942ef03c9,7/27/2023,Battle Royal,http://dummyimage.com/244x100.png/dddddd/000000
657,048ac8f3-806d-4668-aed1-e78aea5128af,dapibus augue,nullam porttitor lacus at turpis donec posuere metus vitae ipsum aliquam non mauris morbi non,8fb25e30-03fd-4f26-9a7c-6738a26d096f,2/10/2023,Adventure,http://dummyimage.com/152x100.png/ff4444/ffffff
658,6969323d-42d8-42cd-b380-35367d588f66,eget,nulla tellus in sagittis dui vel nisl duis ac nibh fusce lacus purus aliquet at feugiat non pretium quis,baa306a0-935c-4395-85ba-0ce7fb89542d,8/18/2023,Battle Royal,http://dummyimage.com/237x100.png/cc0000/ffffff
659,fb7379ba-e3d3-486b-b9c8-d9c88319a030,eu,sapien varius ut blandit non interdum in ante vestibulum ante,ddb7cebb-aa78-4b93-98c7-788015fa3e0d,4/15/2023,Battle Royal,http://dummyimage.com/107x100.png/cc0000/ffffff
660,70df0982-5466-4779-b06e-69334a18a4b3,amet turpis elementum,neque vestibulum eget vulputate ut ultrices vel augue vestibulum ante ipsum primis in,d4c71a54-1fa2-4780-b48e-9ad08fde0bc6,1/20/2023,Sports,http://dummyimage.com/231x100.png/cc0000/ffffff
661,9737b210-9ce1-4d1f-b70a-fb7ade7f0609,amet nulla,lacinia nisi venenatis tristique fusce congue diam id ornare imperdiet sapien urna pretium nisl,480fed14-2721-4da4-849e-b49ebc99592f,10/8/2023,Battle Royal,http://dummyimage.com/238x100.png/5fa2dd/ffffff
662,5a7e7b04-428a-4aba-9aca-80d32c53c520,tortor,maecenas rhoncus aliquam lacus morbi quis tortor id nulla ultrices aliquet maecenas leo odio condimentum id,af8089f7-a8d4-4391-a3e1-8ed90d037d60,5/9/2023,RPG,http://dummyimage.com/216x100.png/dddddd/000000
663,ee3dcb78-08f2-4f50-80e3-c747e1a30248,nonummy,nisl aenean lectus pellentesque eget nunc donec quis orci eget,f20dba1a-00bb-4788-b191-ce69fc14765e,8/22/2023,Horor,http://dummyimage.com/111x100.png/cc0000/ffffff
664,3e1185da-b366-4a68-9181-ddf43dcf6adc,vestibulum sagittis,mollis molestie lorem quisque ut erat curabitur gravida nisi at nibh in hac habitasse platea dictumst,97b2e73a-7e4b-4be5-af4f-406906d2c417,8/9/2023,Adventure,http://dummyimage.com/236x100.png/ff4444/ffffff
665,60c01a39-11e5-486e-b445-09a4579fb0ec,id massa,mauris vulputate elementum nullam varius nulla facilisi cras non velit nec nisi vulputate nonummy maecenas tincidunt lacus at velit,00080ae6-e7e0-406c-8283-491f26abfd9c,5/14/2023,Horor,http://dummyimage.com/186x100.png/ff4444/ffffff
666,f9b8018f-844f-4970-a265-5e9f4a15f7dc,etiam vel,proin interdum mauris non ligula pellentesque ultrices phasellus id sapien in sapien iaculis,0aecf9d2-9b31-4ed7-b285-ab4fe26d6829,11/24/2023,Adventure,http://dummyimage.com/174x100.png/dddddd/000000
667,c3c9b18e-ba2d-4ebd-9de7-bcd3ac752eb3,eget vulputate,eu interdum eu tincidunt in leo maecenas pulvinar lobortis est,3628d0bb-a13f-4714-846c-d456353e6cd1,12/10/2023,Open World,http://dummyimage.com/220x100.png/cc0000/ffffff
668,a2fac49d-59c5-466d-8cab-add80cfdffb2,interdum eu,consectetuer adipiscing elit proin risus praesent lectus vestibulum quam sapien varius,2642fe9e-d58e-44ce-8486-11ad0e2c6888,1/28/2023,Moba,http://dummyimage.com/246x100.png/5fa2dd/ffffff
669,012d2a89-2305-4234-8f81-dadde7760b74,dapibus duis at,curae duis faucibus accumsan odio curabitur convallis duis consequat dui nec nisi volutpat eleifend donec ut dolor morbi,69cc2fc4-86ac-400a-8fb1-76d77756c3c7,7/11/2023,FPS,http://dummyimage.com/144x100.png/ff4444/ffffff
670,c56d164a-e789-4885-a277-821b751eabc9,felis donec,lacus morbi sem mauris laoreet ut rhoncus aliquet pulvinar sed nisl nunc rhoncus dui vel sem sed sagittis nam congue,a281e33b-21cb-4c34-82d2-0208c7ba9de7,1/9/2023,RPG,http://dummyimage.com/136x100.png/cc0000/ffffff
671,7b8146c2-7bb0-457c-ab3c-52355d63f67f,justo sollicitudin,dictumst morbi vestibulum velit id pretium iaculis diam erat fermentum,97d05522-3747-43a3-b951-b9df2eb311fc,4/12/2023,Horor,http://dummyimage.com/146x100.png/dddddd/000000
672,591012fd-d85c-4ea2-84a1-4a002af0084f,neque sapien placerat,vivamus in felis eu sapien cursus vestibulum proin eu mi nulla ac enim in tempor turpis nec euismod scelerisque quam,ea996a44-d8d1-4d74-b2b8-5f2ed1679651,10/25/2023,Horor,http://dummyimage.com/158x100.png/5fa2dd/ffffff
673,79472c13-7cc3-48c3-90fc-22ec509369ff,mattis egestas,proin at turpis a pede posuere nonummy integer non velit donec,22cd4e9a-6cc8-47ac-a2c2-bfe50738452c,8/1/2023,Battle Royal,http://dummyimage.com/133x100.png/cc0000/ffffff
674,5a224a8e-f171-4e5f-b04b-318b624831f0,vestibulum,nulla neque libero convallis eget eleifend luctus ultricies eu nibh quisque id justo sit amet sapien dignissim vestibulum vestibulum,04c13a46-d258-4eb6-bd83-a8574f604e29,6/12/2023,Horor,http://dummyimage.com/146x100.png/cc0000/ffffff
675,9bdfd6fa-e115-40d6-9d26-5c1eef120ba2,sapien,cubilia curae donec pharetra magna vestibulum aliquet ultrices erat tortor sollicitudin mi sit amet lobortis,883f14f6-1e11-451a-b254-e32c6ad770fa,12/2/2023,Open World,http://dummyimage.com/147x100.png/cc0000/ffffff
676,46bbdbcb-d044-4391-b405-2db3a3208b60,proin eu,vestibulum ante ipsum primis in faucibus orci luctus et ultrices posuere cubilia curae donec,490ac9d1-a6a2-48b9-b6d0-43efea3add9c,12/21/2022,RPG,http://dummyimage.com/165x100.png/ff4444/ffffff
677,5518fdcb-aa03-442d-a294-3e342fa14a29,sapien,ligula in lacus curabitur at ipsum ac tellus semper interdum mauris ullamcorper purus sit amet nulla,21255185-629b-4c84-a8fd-33f5829a9c21,3/11/2023,Puzzle,http://dummyimage.com/104x100.png/5fa2dd/ffffff
678,1ac16299-1bbf-4957-a850-751c4f6f005d,libero,nulla facilisi cras non velit nec nisi vulputate nonummy maecenas tincidunt lacus at velit vivamus vel nulla eget eros elementum,e64f3914-3a75-476b-8804-b5a9fe02979b,11/15/2023,Horor,http://dummyimage.com/111x100.png/ff4444/ffffff
679,6bb4c02f-d45a-4148-b0aa-527186faa0c3,consequat,sit amet sem fusce consequat nulla nisl nunc nisl duis bibendum felis sed interdum venenatis turpis enim blandit mi in,a5e634c4-0e20-4b57-8c5c-f16bf88c6349,1/21/2023,RPG,http://dummyimage.com/113x100.png/dddddd/000000
680,b51f4b03-8007-4de5-93fa-016568184c42,rutrum at lorem,nulla ultrices aliquet maecenas leo odio condimentum id luctus nec molestie sed justo pellentesque viverra pede ac diam,ed797f10-c738-4809-ba51-4b295dea1661,9/24/2023,Sports,http://dummyimage.com/180x100.png/cc0000/ffffff
681,8a22816d-4d7e-4006-adea-b3d53c3281ae,amet sapien dignissim,vel est donec odio justo sollicitudin ut suscipit a feugiat et,c2fa726f-c27b-4a9f-a02a-e15fc728ea16,11/26/2023,Open World,http://dummyimage.com/169x100.png/cc0000/ffffff
682,189650ca-11c9-48de-955a-59be4bd17763,a nibh in,donec odio justo sollicitudin ut suscipit a feugiat et eros vestibulum ac est lacinia,8c94fbda-98c0-4e6f-9b3b-a721e4457274,3/14/2023,Battle Royal,http://dummyimage.com/141x100.png/5fa2dd/ffffff
683,33280be5-865d-46a7-b4d9-08676d9fb794,odio cras mi,nisl venenatis lacinia aenean sit amet justo morbi ut odio cras mi pede malesuada in,16f5b914-028f-40f1-9ca2-3c65014908f8,6/27/2023,Horor,http://dummyimage.com/207x100.png/cc0000/ffffff
684,9f4973ca-4c49-46b1-af06-b3396cc022b4,convallis nulla neque,lacinia nisi venenatis tristique fusce congue diam id ornare imperdiet sapien urna pretium,3dbcf9b2-6840-4353-b681-f037647deafb,10/28/2023,RPG,http://dummyimage.com/108x100.png/ff4444/ffffff
685,18b2959b-effb-4ecf-b2eb-4b6f5bf4eb4a,amet consectetuer adipiscing,sollicitudin ut suscipit a feugiat et eros vestibulum ac est lacinia nisi venenatis tristique fusce congue diam id ornare,202f8643-7b36-4516-b7e7-f805af48a90f,6/20/2023,Puzzle,http://dummyimage.com/217x100.png/ff4444/ffffff
686,ff6d209a-b9d3-4ed7-a574-e24b1d283ad0,tempus,quis turpis sed ante vivamus tortor duis mattis egestas metus aenean fermentum donec ut mauris eget,bfd33890-8f31-4c1d-934c-f53821d88649,7/6/2023,Open World,http://dummyimage.com/184x100.png/5fa2dd/ffffff
687,5d229b1b-2a26-4d83-bbc2-cb972bffdd65,semper,donec pharetra magna vestibulum aliquet ultrices erat tortor sollicitudin mi sit amet lobortis sapien sapien non mi integer,61575b44-89eb-4cfd-a474-24beaf8b6763,12/5/2023,Sports,http://dummyimage.com/249x100.png/ff4444/ffffff
688,d65d9715-a74d-4cfe-b29d-929799f3c59f,nascetur ridiculus mus,condimentum neque sapien placerat ante nulla justo aliquam quis turpis eget elit sodales scelerisque mauris sit amet,09d11ff3-2a92-4319-8125-a75fbdc621ec,2/23/2023,Open World,http://dummyimage.com/171x100.png/dddddd/000000
689,a238d593-ec45-4b1f-a321-5361d1028220,natoque,turpis nec euismod scelerisque quam turpis adipiscing lorem vitae mattis nibh,d9a55569-d4b1-4add-b34c-f96ecadf64c8,8/10/2023,Sports,http://dummyimage.com/181x100.png/ff4444/ffffff
690,150f285b-8210-4424-bf9d-39d9a3e9852d,ut,non interdum in ante vestibulum ante ipsum primis in faucibus orci luctus et ultrices posuere cubilia,df5225ff-4368-4cfb-b71a-797386424f20,4/23/2023,Battle Royal,http://dummyimage.com/108x100.png/ff4444/ffffff
691,9dfe931a-c2d4-46e3-bf16-ea74a8e3d9b2,tellus in sagittis,erat volutpat in congue etiam justo etiam pretium iaculis justo in hac,a84e58bd-fd49-466f-aaa5-cfdfd77c6ca0,10/6/2023,Sports,http://dummyimage.com/191x100.png/ff4444/ffffff
692,c334ff2c-ac87-4f25-a858-f4d128caa31b,vestibulum quam sapien,aliquet maecenas leo odio condimentum id luctus nec molestie sed justo pellentesque viverra,c62359ac-6390-4bb4-8010-7aabe0b97ecd,1/24/2023,Adventure,http://dummyimage.com/128x100.png/cc0000/ffffff
693,7169aa60-8e65-44e4-a70c-0546b9927928,a pede,in leo maecenas pulvinar lobortis est phasellus sit amet erat nulla tempus,df078cdc-d4d5-4d31-8991-4103cb5725d1,1/1/2023,FPS,http://dummyimage.com/116x100.png/5fa2dd/ffffff
694,a3d709b5-78ab-4683-8548-5d3c3e865782,justo,ut erat curabitur gravida nisi at nibh in hac habitasse platea dictumst,20a23d34-8cef-4fc2-aa65-bbf773f5fd73,7/17/2023,Moba,http://dummyimage.com/237x100.png/cc0000/ffffff
695,de9f3ea1-db79-40fd-b28e-abc0495bc053,integer non velit,nunc proin at turpis a pede posuere nonummy integer non velit donec diam neque vestibulum,c3c6c878-5a3a-4560-96ad-cce24de275b4,9/29/2023,Adventure,http://dummyimage.com/192x100.png/ff4444/ffffff
696,24aaedf2-045a-496c-90b6-adc480ed29d1,aenean fermentum donec,ac est lacinia nisi venenatis tristique fusce congue diam id ornare imperdiet,5321f9b6-d0e5-4615-b563-b1b1af4f4809,4/10/2023,Open World,http://dummyimage.com/108x100.png/cc0000/ffffff
697,d29775ff-8cf6-4a81-b1e4-6aa423b4514e,cubilia curae,lectus aliquam sit amet diam in magna bibendum imperdiet nullam orci pede venenatis non sodales,da97618d-d0e2-4f7e-b686-e5fc643ac4b4,9/9/2023,Adventure,http://dummyimage.com/207x100.png/5fa2dd/ffffff
698,27092b9d-dd54-4667-a2b1-599ac6e19cc7,maecenas,eros vestibulum ac est lacinia nisi venenatis tristique fusce congue diam id ornare imperdiet sapien urna pretium nisl ut volutpat,cbc5143a-5966-4ba3-96f5-e60674f84c84,1/29/2023,Puzzle,http://dummyimage.com/112x100.png/cc0000/ffffff
699,9b4dc3f8-f44a-4d73-bc51-4fdfc0b133ae,sapien,in libero ut massa volutpat convallis morbi odio odio elementum,d92feda0-ab60-4c16-9e57-b8e6aa6566f0,9/22/2023,Puzzle,http://dummyimage.com/228x100.png/dddddd/000000
700,cd6f1b9d-8a97-4bb5-aeb8-3bb211d109c3,posuere metus vitae,congue diam id ornare imperdiet sapien urna pretium nisl ut volutpat sapien arcu sed augue,c628f50f-1511-47ca-bf0c-afc76e2a22a4,10/11/2023,Battle Royal,http://dummyimage.com/133x100.png/ff4444/ffffff
701,d7954fe4-4f86-450a-bf96-1ccbee99b69c,quis,vestibulum ante ipsum primis in faucibus orci luctus et ultrices posuere cubilia curae duis faucibus accumsan odio curabitur,2e063306-2083-44a6-91d1-deee5780f0e7,6/16/2023,Moba,http://dummyimage.com/181x100.png/5fa2dd/ffffff
702,ca87eb16-8f55-41e6-9080-47d1f1ff08d2,neque vestibulum,eleifend quam a odio in hac habitasse platea dictumst maecenas ut massa quis augue luctus tincidunt nulla mollis molestie,8e89dc4d-77e1-42a6-b9e9-2ad28dab1a68,11/4/2023,Battle Royal,http://dummyimage.com/178x100.png/5fa2dd/ffffff
703,8835d6d2-cb19-4eb5-a85c-10df4dd31ae3,in consequat,nunc nisl duis bibendum felis sed interdum venenatis turpis enim blandit mi in porttitor pede justo eu massa donec,abd30aba-38f0-4589-8770-0213b58b541e,11/5/2023,Puzzle,http://dummyimage.com/163x100.png/cc0000/ffffff
704,98f2a050-334d-4d92-81f5-78ad323cd0c0,nisi,pede lobortis ligula sit amet eleifend pede libero quis orci nullam molestie nibh in lectus pellentesque at nulla suspendisse potenti,49cca131-ade7-413f-9558-36564a44ad05,3/28/2023,RPG,http://dummyimage.com/114x100.png/5fa2dd/ffffff
705,3e3e208a-d8f8-43cf-8538-b831c2ab103e,sapien non,et ultrices posuere cubilia curae nulla dapibus dolor vel est,800853f8-1394-412b-91ac-69faace016f9,8/8/2023,Horor,http://dummyimage.com/127x100.png/dddddd/000000
706,53199ea4-4945-44ec-be1e-3c503d629ec3,vulputate,posuere nonummy integer non velit donec diam neque vestibulum eget vulputate ut ultrices,5490d4cc-abb7-4215-a2f6-5856e105bb52,6/2/2023,Open World,http://dummyimage.com/155x100.png/dddddd/000000
707,2722f76b-3356-4131-88eb-17feea48a26d,mi,habitasse platea dictumst maecenas ut massa quis augue luctus tincidunt nulla mollis molestie lorem quisque ut erat curabitur gravida nisi,9826021a-db6d-41f5-bf39-1719075a4adf,6/28/2023,Open World,http://dummyimage.com/150x100.png/5fa2dd/ffffff
708,eefce99f-681e-41c0-a060-6a894fc4fd57,auctor,donec posuere metus vitae ipsum aliquam non mauris morbi non,89037ca8-863a-4c2f-bfc2-c8c14fdcf30d,5/7/2023,Adventure,http://dummyimage.com/113x100.png/cc0000/ffffff
709,6afa7160-6674-4298-b831-e8ce7cbd28de,elementum nullam varius,orci pede venenatis non sodales sed tincidunt eu felis fusce,404c47bc-dc0b-4410-aded-a7cd237e937c,8/15/2023,Sports,http://dummyimage.com/186x100.png/5fa2dd/ffffff
710,97c4db69-ea59-48a8-8004-da655308ef4a,nulla,porttitor pede justo eu massa donec dapibus duis at velit eu est congue elementum,0ee17671-3968-4146-a925-7e3d5608a0e7,4/14/2023,Puzzle,http://dummyimage.com/126x100.png/dddddd/000000
711,5eb40682-7d68-4a90-9fa9-fd4ba5608340,felis sed,cras pellentesque volutpat dui maecenas tristique est et tempus semper,0c31d8f0-9d04-4fbe-a419-bf0b02e008b4,8/6/2023,Puzzle,http://dummyimage.com/137x100.png/dddddd/000000
712,fa3c15dd-1e18-4103-8187-3d29e6c31a90,quisque,morbi non quam nec dui luctus rutrum nulla tellus in sagittis dui vel nisl,c3d702e0-a476-46a2-94be-97cc061bc6f7,2/20/2023,Puzzle,http://dummyimage.com/240x100.png/5fa2dd/ffffff
713,6c87dad6-bc8a-49bd-a85d-465c609bfd21,eu,amet sapien dignissim vestibulum vestibulum ante ipsum primis in faucibus orci,67dbe9d9-df88-4e33-8ec8-8e9a1cb8e04a,8/12/2023,Sports,http://dummyimage.com/182x100.png/5fa2dd/ffffff
