id_project,project_id,project_name,project_desc,user_id,deadline,game_type,imgUrl
307,d6cb67d8-a1d9-4bbb-9087-0297da97ecda,lacus at,sed interdum venenatis turpis enim blandit mi in porttitor pede justo eu massa donec dapibus duis at,4c049e8d-1efd-4955-8a12-648477484aff,7/13/2023,Open World,http://dummyimage.com/103x100.png/cc0000/ffffff
308,8c263eb5-22a6-42dc-a599-59f2cc62ae65,sit amet eleifend,magna ac consequat metus sapien ut nunc vestibulum ante ipsum primis in faucibus orci luctus et ultrices posuere cubilia,23cde262-4fd6-4f67-bb60-a19cfd86bafa,12/25/2022,Adventure,http://dummyimage.com/230x100.png/dddddd/000000
309,7c4727eb-d2f9-4961-8a2b-f657a0a8ef24,augue vestibulum rutrum,duis at velit eu est congue elementum in hac habitasse platea dictumst morbi,0833f043-ff5d-464f-b767-7621734b0cbd,9/13/2023,Moba,http://dummyimage.com/128x100.png/dddddd/000000
310,9b935862-d6eb-442a-9e6a-c0dbef4cb17b,vel nulla,ligula in lacus curabitur at ipsum ac tellus semper interdum mauris ullamcorper purus sit,d02a2054-b70b-44b0-9640-d6252a481413,2/28/2023,Horor,http://dummyimage.com/100x100.png/cc0000/ffffff
311,8725cddd-a0a7-47aa-b524-de7c7fd9b0c3,augue,commodo placerat praesent blandit nam nulla integer pede justo lacinia eget tincidunt eget tempus,d723d1b2-7031-4e67-9ad9-954785bae52c,11/13/2023,Horor,http://dummyimage.com/136x100.png/cc0000/ffffff
312,7e59cf53-dc82-48ed-b81f-02dfa01d12d3,tortor id,mus vivamus vestibulum sagittis sapien cum sociis natoque penatibus et magnis dis parturient montes nascetur ridiculus mus etiam vel,8f4a57df-8fc9-400b-b28b-9928796bf5c2,6/7/2023,Horor,http://dummyimage.com/222x100.png/cc0000/ffffff
313,b7e0534b-543c-4e85-91dd-2361f2391d83,ante vivamus,tempus semper est quam pharetra magna ac consequat metus sapien ut nunc vestibulum ante ipsum primis,083fc2bf-acee-4e59-b11e-6072a5a01f23,9/8/2023,RPG,http://dummyimage.com/159x100.png/cc0000/ffffff
314,98c04fbf-d016-488c-b2e8-b867ac810bc7,in,nascetur ridiculus mus etiam vel augue vestibulum rutrum rutrum neque aenean auctor gravida sem praesent id,3920fbbb-b3e9-4fbf-b8c1-8975737481b8,7/13/2023,Battle Royal,http://dummyimage.com/106x100.png/ff4444/ffffff
315,589343f8-4241-4f05-b310-48f3bfc07bf5,quam pede lobortis,cras mi pede malesuada in imperdiet et commodo vulputate justo in blandit ultrices enim lorem ipsum dolor,e599e585-a97d-4134-adba-38275627a261,7/8/2023,FPS,http://dummyimage.com/120x100.png/5fa2dd/ffffff
316,ed055756-9303-40fe-bc5e-964b1b7531fc,semper,duis aliquam convallis nunc proin at turpis a pede posuere nonummy integer non velit donec diam neque vestibulum eget vulputate,a96ee328-7398-45a7-a754-122aa4f7d34c,4/22/2023,RPG,http://dummyimage.com/246x100.png/ff4444/ffffff
317,0237443e-46cf-4cb1-bc4d-1d0ec0680b0f,erat volutpat,venenatis tristique fusce congue diam id ornare imperdiet sapien urna pretium nisl ut volutpat,ff30a0fe-6dac-4654-9867-fb26d3893319,3/22/2023,Puzzle,http://dummyimage.com/119x100.png/dddddd/000000
318,c4e418c3-6741-460b-ac47-30a31a1c1e8a,nulla,molestie hendrerit at vulputate vitae nisl aenean lectus pellentesque eget nunc donec quis orci eget orci,ca654e3d-07ec-4f50-b3f2-268c437c7352,1/16/2023,FPS,http://dummyimage.com/113x100.png/dddddd/000000
319,6c030c6f-1284-4fd4-adeb-fbcfa36bab19,ac,erat vestibulum sed magna at nunc commodo placerat praesent blandit nam nulla integer pede justo lacinia,6916d468-0f74-4563-b664-3ac4131a351b,12/15/2023,Moba,http://dummyimage.com/134x100.png/ff4444/ffffff
320,0b699043-b493-49e6-ac04-ee42865788de,ipsum dolor sit,vestibulum aliquet ultrices erat tortor sollicitudin mi sit amet lobortis sapien sapien non mi integer ac,fccaf5d4-5bd9-4fdc-9ae4-4c173d682163,6/17/2023,Open World,http://dummyimage.com/232x100.png/cc0000/ffffff
321,e7335628-3036-4173-b751-0d04c815be84,in,eleifend luctus ultricies eu nibh quisque id justo sit amet sapien dignissim vestibulum vestibulum ante ipsum primis,0e6223f2-66f8-48b2-b1dc-8a09ab03cea3,7/6/2023,FPS,http://dummyimage.com/178x100.png/ff4444/ffffff
322,e69008bc-c16d-4a7b-a1db-acebdbbde4f5,urna,et eros vestibulum ac est lacinia nisi venenatis tristique fusce congue diam id ornare imperdiet sapien urna pretium nisl,875d3fa4-8d29-4993-9820-53c137b4627d,10/7/2023,Battle Royal,http://dummyimage.com/175x100.png/5fa2dd/ffffff
323,7fa37c3b-777c-4329-8088-703d523ab6ea,nibh fusce,neque vestibulum eget vulputate ut ultrices vel augue vestibulum ante ipsum primis in faucibus,b240cb5d-c4c5-4bc4-8c50-55d1f4c599bd,9/28/2023,Adventure,http://dummyimage.com/134x100.png/5fa2dd/ffffff
324,720220e2-a338-4f44-a897-b574b27f3ada,id massa,magnis dis parturient montes nascetur ridiculus mus etiam vel augue vestibulum rutrum rutrum neque aenean auctor,a5eab075-1b59-4e58-b054-ef2ee8622653,7/15/2023,Puzzle,http://dummyimage.com/215x100.png/5fa2dd/ffffff
325,a15511d7-35d4-4cb1-b11f-bfda45d470bc,viverra,tempus vivamus in felis eu sapien cursus vestibulum proin eu mi nulla ac enim,ecb248ee-2c91-4457-9aa1-4cf5e7c0b6dc,3/3/2023,FPS,http://dummyimage.com/131x100.png/ff4444/ffffff
326,f9286085-9a51-49a3-b3cd-2cddb480b902,imperdiet nullam orci,morbi ut odio cras mi pede malesuada in imperdiet et commodo vulputate justo in blandit ultrices enim lorem ipsum,9c19e7d5-654c-456d-b27f-0603b5c302eb,3/8/2023,Horor,http://dummyimage.com/104x100.png/5fa2dd/ffffff
327,117e5a00-b5c7-4133-a090-aa78c83782a8,justo in hac,massa tempor convallis nulla neque libero convallis eget eleifend luctus,161f9f0f-7e9d-4e98-a1b3-0e03e2039acc,7/4/2023,FPS,http://dummyimage.com/241x100.png/cc0000/ffffff
328,043d1637-e975-422b-8912-b45962722fa5,in tempor turpis,elementum in hac habitasse platea dictumst morbi vestibulum velit id pretium,877a744a-af08-46b1-aab3-56782c6522fa,8/9/2023,Adventure,http://dummyimage.com/192x100.png/ff4444/ffffff
329,bedee615-8a5c-488d-90f5-9c56f4d3dd18,rhoncus,eros vestibulum ac est lacinia nisi venenatis tristique fusce congue diam id ornare imperdiet sapien urna pretium nisl,ed1b0615-d6e8-4df3-afeb-cd0f20002c7e,9/9/2023,Puzzle,http://dummyimage.com/135x100.png/dddddd/000000
330,7d21cdc0-1b35-44f3-b240-613ba8bd8e43,pulvinar lobortis,volutpat dui maecenas tristique est et tempus semper est quam pharetra magna ac consequat metus sapien ut nunc,31948f32-96e5-4688-bb36-443693e816c8,8/16/2023,Puzzle,http://dummyimage.com/170x100.png/ff4444/ffffff
331,6716cbac-1c1e-436d-999f-115fd9823d89,curabitur gravida nisi,integer ac leo pellentesque ultrices mattis odio donec vitae nisi nam,cca22770-7d23-4626-9196-ba2de084af3b,10/27/2023,Battle Royal,http://dummyimage.com/123x100.png/5fa2dd/ffffff
332,3653ee4f-4360-4e04-aa8d-b7a6b0d7457c,velit nec nisi,risus auctor sed tristique in tempus sit amet sem fusce consequat nulla nisl nunc,eb7a84b7-971b-4b61-a081-b6843191f7a6,8/12/2023,Moba,http://dummyimage.com/249x100.png/ff4444/ffffff
333,717d8664-5a9b-40d5-b822-868a48cc216d,at turpis,ut mauris eget massa tempor convallis nulla neque libero convallis eget eleifend luctus ultricies eu nibh quisque id justo sit,04b6cade-b787-4317-9692-48f181933e2b,4/5/2023,Adventure,http://dummyimage.com/194x100.png/cc0000/ffffff
334,55ae277d-6174-4474-8b12-0e15adf1851e,diam,quis turpis eget elit sodales scelerisque mauris sit amet eros suspendisse accumsan tortor quis,d40e84f2-8261-425d-a011-3cebfeabe7d7,2/10/2023,Adventure,http://dummyimage.com/182x100.png/dddddd/000000
335,3e19f8ad-2934-46fd-a17f-6f3ae04ea0bf,eros elementum pellentesque,est et tempus semper est quam pharetra magna ac consequat metus sapien,0807d848-9f99-4038-81d9-7c603b3b9b42,6/22/2023,Battle Royal,http://dummyimage.com/194x100.png/5fa2dd/ffffff
336,1882ddfc-98bd-4046-a58f-85235d2413fd,a odio,in libero ut massa volutpat convallis morbi odio odio elementum,d96539a3-db59-4acb-944a-0a90a27012f2,3/26/2023,Open World,http://dummyimage.com/200x100.png/ff4444/ffffff
337,c4186f4b-48c1-433f-8074-c405eb6c3298,morbi quis tortor,pede libero quis orci nullam molestie nibh in lectus pellentesque at nulla suspendisse potenti cras in purus,ea9de506-ce6d-4843-9617-41ff4795d61a,4/10/2023,FPS,http://dummyimage.com/116x100.png/5fa2dd/ffffff
338,4359446f-19b3-46a3-8710-4b75325f853b,cras in,eu felis fusce posuere felis sed lacus morbi sem mauris laoreet ut rhoncus aliquet pulvinar sed,7a835bea-7623-4724-8f8b-7b84b3da14c5,9/4/2023,RPG,http://dummyimage.com/134x100.png/dddddd/000000
339,d2e4c85f-54e5-492d-9707-de0d4b36b04f,nibh,quam sollicitudin vitae consectetuer eget rutrum at lorem integer tincidunt ante,5cfbc7fc-d01c-4c00-90c8-b41a1315b44a,12/6/2023,Open World,http://dummyimage.com/223x100.png/ff4444/ffffff
340,8fdedf1b-09c4-4593-bed9-b413e96fe143,sit amet,nullam sit amet turpis elementum ligula vehicula consequat morbi a ipsum integer a nibh in quis,c7a059f3-cca7-4716-9a4e-f35b8714783c,5/28/2023,Horor,http://dummyimage.com/137x100.png/cc0000/ffffff
341,01a8bece-7c13-4298-8a2f-f998a6cca37f,nonummy integer non,leo rhoncus sed vestibulum sit amet cursus id turpis integer aliquet massa id lobortis convallis tortor,31f6348b-ee9b-4dee-aab7-f4e5a8c9c0c7,6/11/2023,RPG,http://dummyimage.com/122x100.png/dddddd/000000
342,1f0b8e1c-7220-4f1c-8532-c945915e08b9,quam pharetra,rutrum neque aenean auctor gravida sem praesent id massa id nisl venenatis lacinia aenean,cc75d804-2bbf-46fc-b6bf-b22311a3f24e,9/15/2023,RPG,http://dummyimage.com/208x100.png/5fa2dd/ffffff
343,da44c05c-05f5-4d51-b831-7e7d97716fd9,nullam,rhoncus sed vestibulum sit amet cursus id turpis integer aliquet massa id lobortis convallis tortor risus dapibus augue vel accumsan,5fdedf19-3e67-48b2-acee-a8d1ef791b6a,11/15/2023,Puzzle,http://dummyimage.com/197x100.png/5fa2dd/ffffff
344,07066697-8691-4c03-8584-18a9b0a72cc7,ultrices posuere cubilia,diam vitae quam suspendisse potenti nullam porttitor lacus at turpis,ae3e88f1-0723-4e52-bae7-c46d59ba4f81,7/4/2023,Horor,http://dummyimage.com/239x100.png/ff4444/ffffff
345,e3b73e07-39ff-40ac-a08e-2fd82fed14d2,duis,nisi nam ultrices libero non mattis pulvinar nulla pede ullamcorper augue a suscipit nulla elit ac,405d648d-3a8d-4477-8876-0cfb128ca18e,2/25/2023,Battle Royal,http://dummyimage.com/168x100.png/5fa2dd/ffffff
346,8ed1ba86-7e4a-447f-b7ff-accfeffc2a5f,rutrum nulla nunc,erat id mauris vulputate elementum nullam varius nulla facilisi cras non,c23d2cb2-acc3-4a9f-936f-645ce1335b5a,1/7/2023,Open World,http://dummyimage.com/104x100.png/dddddd/000000
347,6b00b94c-fe6b-40df-942a-37da2e54a97f,metus aenean,purus phasellus in felis donec semper sapien a libero nam dui proin,8b893cb1-b821-4c38-86bb-5dbce7b1f37a,5/28/2023,Adventure,http://dummyimage.com/157x100.png/ff4444/ffffff
348,2a77607c-5f27-4020-822a-afe24a836a8f,cubilia curae,duis aliquam convallis nunc proin at turpis a pede posuere nonummy integer,bf2e84cc-7dc3-4a22-a138-67c222d06d9d,11/1/2023,Open World,http://dummyimage.com/109x100.png/5fa2dd/ffffff
349,d4f14c77-bbe8-42f8-932e-f4704f5d6de0,in faucibus,lacus morbi sem mauris laoreet ut rhoncus aliquet pulvinar sed nisl nunc rhoncus dui vel sem,9806f7c7-5697-4cce-a8f8-e8c33de318d2,10/14/2023,Puzzle,http://dummyimage.com/163x100.png/cc0000/ffffff
350,08063041-621e-4de0-8e8d-eb3b5ca1b5e9,purus aliquet,cursus vestibulum proin eu mi nulla ac enim in tempor turpis nec euismod scelerisque,902e4f25-2bae-40df-943f-5b722032d02e,11/13/2023,Open World,http://dummyimage.com/218x100.png/cc0000/ffffff
351,b4abdbd2-6258-4218-9987-08240bbb1917,quam sollicitudin vitae,condimentum curabitur in libero ut massa volutpat convallis morbi odio odio elementum eu interdum eu tincidunt in leo,8ab1cf74-ccf9-40c1-922b-6ff9566a5c36,12/10/2023,Sports,http://dummyimage.com/172x100.png/5fa2dd/ffffff
352,433e58e3-793b-4e72-8df9-8fc1bf9a461d,quam pede lobortis,quisque porta volutpat erat quisque erat eros viverra eget congue eget semper rutrum nulla nunc purus phasellus,781cf90a-4281-4d39-8200-b90d169dafd6,9/11/2023,Adventure,http://dummyimage.com/144x100.png/5fa2dd/ffffff
353,2a62abcf-5303-42de-9004-a23119ef56c5,quam,non velit nec nisi vulputate nonummy maecenas tincidunt lacus at velit vivamus vel nulla,37c3f31c-22f4-4e49-92ea-576c18cfed41,10/20/2023,Sports,http://dummyimage.com/114x100.png/cc0000/ffffff
354,20469066-6a24-49ce-9a8b-53a6d18234c8,in,est risus auctor sed tristique in tempus sit amet sem fusce consequat nulla nisl nunc,fb2b00e4-bcdf-492b-9470-da7e2f148bc6,2/17/2023,FPS,http://dummyimage.com/145x100.png/dddddd/000000
355,ef68c346-6881-4e69-a102-52247b3eb8e8,gravida sem praesent,suspendisse ornare consequat lectus in est risus auctor sed tristique in tempus sit amet,3e6b1e4e-a3fe-41cf-8170-d192ae35e374,4/17/2023,RPG,http://dummyimage.com/229x100.png/dddddd/000000
356,9d827ac9-8975-4af8-81fe-b252733be2e5,fermentum justo nec,augue vestibulum ante ipsum primis in faucibus orci luctus et ultrices,d9072094-2818-4a0d-8cf9-55cf39129824,1/18/2023,Open World,http://dummyimage.com/122x100.png/cc0000/ffffff
357,8ea0f738-d1ef-4f7e-9741-4612b1e9334b,accumsan odio curabitur,enim lorem ipsum dolor sit amet consectetuer adipiscing elit proin interdum mauris non ligula pellentesque,37f45729-55aa-43f6-9fc8-fd6148ee5742,6/28/2023,Sports,http://dummyimage.com/136x100.png/dddddd/000000
358,652bd1fd-14a3-454b-afc5-3a05d0d8373b,nibh,tellus semper interdum mauris ullamcorper purus sit amet nulla quisque,c5e13ffe-c372-43c9-8ff1-f112337572f9,4/29/2023,Adventure,http://dummyimage.com/101x100.png/dddddd/000000
359,79292ecf-b6a4-4155-bf8e-031fe3a286bd,sem sed sagittis,pellentesque volutpat dui maecenas tristique est et tempus semper est quam pharetra magna ac,2a857c4b-f719-4d0c-a081-75ba04c12681,1/2/2023,RPG,http://dummyimage.com/219x100.png/cc0000/ffffff
360,8aae404b-acb1-452c-8b7a-bafc084f9e68,non,semper sapien a libero nam dui proin leo odio porttitor id consequat in consequat ut nulla sed,e9406715-5c81-4e65-93d6-060b96b4f4dd,6/7/2023,Sports,http://dummyimage.com/121x100.png/ff4444/ffffff
361,12f0890b-fb9c-4e89-bf6c-2a4bc8ff67c7,urna ut,et magnis dis parturient montes nascetur ridiculus mus etiam vel augue vestibulum rutrum rutrum,b534300a-c5b4-4186-b9d5-f069de9965d7,11/9/2023,Moba,http://dummyimage.com/180x100.png/5fa2dd/ffffff
362,6a95b05d-4a87-46a3-9bf4-300a1974e175,non,aliquet pulvinar sed nisl nunc rhoncus dui vel sem sed,f0a9e1fe-3014-4154-ac48-05b6e7c1ad62,10/30/2023,Battle Royal,http://dummyimage.com/151x100.png/ff4444/ffffff
363,f56884d3-6464-4b37-a381-6f85d422d966,sed sagittis,eros elementum pellentesque quisque porta volutpat erat quisque erat eros viverra eget congue eget semper rutrum,2c3bb051-9442-4374-8269-e5ca2a698e55,1/10/2023,Adventure,http://dummyimage.com/127x100.png/dddddd/000000
364,158f8c97-25f9-4f56-a712-65197d1199a1,vestibulum,ultrices posuere cubilia curae mauris viverra diam vitae quam suspendisse,2fa1697e-7ec1-4936-8810-56e1eeb6c7e2,2/23/2023,Sports,http://dummyimage.com/114x100.png/ff4444/ffffff
365,e4876143-20e1-45a0-9d43-1f580f35c680,suspendisse ornare,libero non mattis pulvinar nulla pede ullamcorper augue a suscipit nulla elit ac nulla sed vel enim sit amet,1f47aa90-2ea4-4068-81d1-3cd4273e925f,3/5/2023,FPS,http://dummyimage.com/141x100.png/dddddd/000000
366,12d3ca27-7565-4efd-b0e0-e6576311caf6,ac est lacinia,vehicula consequat morbi a ipsum integer a nibh in quis justo,5140dd37-c5b6-4a21-9312-bd1be44ca3d3,4/19/2023,RPG,http://dummyimage.com/113x100.png/ff4444/ffffff
367,180bbf50-232d-416f-955b-a0873498c396,non sodales,luctus et ultrices posuere cubilia curae donec pharetra magna vestibulum aliquet ultrices erat tortor,8202f4d2-31ca-44f5-b653-f025e4396698,11/10/2023,Battle Royal,http://dummyimage.com/109x100.png/cc0000/ffffff
368,74ee4f22-1b10-4851-984b-60d091d4f1e9,natoque penatibus,porttitor pede justo eu massa donec dapibus duis at velit eu est congue elementum in,7c170cf7-a171-4bc4-a64e-ebe3df1d9d2c,3/21/2023,Sports,http://dummyimage.com/196x100.png/cc0000/ffffff
369,243364f2-6978-486d-81d6-9b0652fa6f75,condimentum id luctus,habitasse platea dictumst maecenas ut massa quis augue luctus tincidunt nulla mollis molestie lorem quisque ut,5e74d392-9808-43e5-89f0-62de5a0fa7db,11/4/2023,Moba,http://dummyimage.com/131x100.png/ff4444/ffffff
370,359ad983-baf8-4b02-9586-e91b5ad4f96b,donec vitae,quis justo maecenas rhoncus aliquam lacus morbi quis tortor id nulla,da6e27cd-0102-4a61-aebf-85614c1d27e6,2/15/2023,Moba,http://dummyimage.com/196x100.png/dddddd/000000
371,3c470740-1150-4c4a-9061-1046082a0567,nibh in quis,mi nulla ac enim in tempor turpis nec euismod scelerisque quam turpis,b12ba6ba-2607-4da0-bb16-aa17c61e6692,12/16/2023,Puzzle,http://dummyimage.com/205x100.png/5fa2dd/ffffff
372,a230005a-e9e3-48b7-96aa-eabac638c42b,quis orci,molestie hendrerit at vulputate vitae nisl aenean lectus pellentesque eget nunc donec quis orci,d2a11311-bd22-4bc1-b066-8b4a87ed2459,10/10/2023,Sports,http://dummyimage.com/171x100.png/dddddd/000000
373,13133dd6-5337-4152-9a76-767d9b0f0a5f,vel,nam ultrices libero non mattis pulvinar nulla pede ullamcorper augue a suscipit nulla elit ac nulla sed vel enim,6f6807c2-8690-47b7-9c0f-fc4518e49d42,1/5/2023,Horor,http://dummyimage.com/116x100.png/5fa2dd/ffffff
374,1452adcf-aac3-453e-bab5-e33bf79c74ca,ipsum dolor sit,justo lacinia eget tincidunt eget tempus vel pede morbi porttitor lorem id ligula suspendisse ornare,68c905f1-c6e9-45f1-a480-a4868119a3b5,9/10/2023,FPS,http://dummyimage.com/146x100.png/5fa2dd/ffffff
375,8083dc07-8867-478f-ae21-bdd7a73dee77,laoreet,nulla nunc purus phasellus in felis donec semper sapien a libero nam dui proin leo odio porttitor id consequat in,63c3b388-4ba1-42ed-9a58-a01556da2ffd,6/24/2023,Sports,http://dummyimage.com/124x100.png/5fa2dd/ffffff
376,04694d9e-b866-4ec6-90dc-9dc17a3b19f0,felis,ac enim in tempor turpis nec euismod scelerisque quam turpis adipiscing lorem vitae mattis nibh ligula nec sem duis,5f2dd288-b084-43d0-8dd4-07bbd098d003,8/2/2023,Puzzle,http://dummyimage.com/174x100.png/cc0000/ffffff
377,489350cd-8ed6-4c58-aafd-8bb0bea16cdf,ut,vitae mattis nibh ligula nec sem duis aliquam convallis nunc proin at turpis a pede posuere nonummy integer,09bbe026-9152-4d98-806d-ea4dc0d4b2e7,11/26/2023,RPG,http://dummyimage.com/212x100.png/5fa2dd/ffffff
378,69797e1d-32d1-4cc0-83dc-31b333253f64,ut dolor morbi,ultrices aliquet maecenas leo odio condimentum id luctus nec molestie sed justo pellentesque viverra pede ac diam,c7543629-e00a-414d-a4b3-b0cd5a0ff036,3/12/2023,Moba,http://dummyimage.com/193x100.png/cc0000/ffffff
379,be0e177b-85c2-484e-929a-a49b24a6bbae,mattis odio donec,suscipit nulla elit ac nulla sed vel enim sit amet,ceada953-b914-40e0-8447-04544a9cb806,11/6/2023,Open World,http://dummyimage.com/230x100.png/cc0000/ffffff
380,3fd80193-7996-41f3-9057-d3329831962f,justo in blandit,ipsum primis in faucibus orci luctus et ultrices posuere cubilia curae nulla dapibus dolor,327d47f4-c285-4b2e-beed-b14711af1a0f,4/26/2023,Moba,http://dummyimage.com/229x100.png/cc0000/ffffff
381,9faed30a-2394-484b-b5b6-a4b274bdd59a,neque duis bibendum,aenean sit amet justo morbi ut odio cras mi pede malesuada in imperdiet et commodo vulputate justo in,7e37e352-fb47-4c9a-b124-a211a7ef6ff7,12/29/2022,Sports,http://dummyimage.com/218x100.png/ff4444/ffffff
382,a8ec1d4e-90ac-4502-8b43-8f34d4d5e2f9,dictumst morbi vestibulum,dolor sit amet consectetuer adipiscing elit proin interdum mauris non ligula pellentesque ultrices phasellus id sapien in sapien iaculis congue,d6575555-91ef-4ee3-9ba1-1325952708ef,2/5/2023,Moba,http://dummyimage.com/179x100.png/ff4444/ffffff
383,cbbe97e0-1671-41e5-ac37-f578e5fe99b3,diam neque,quam sapien varius ut blandit non interdum in ante vestibulum,5452b97e-a4a6-4eeb-99e7-e6c687995e00,11/24/2023,Puzzle,http://dummyimage.com/237x100.png/ff4444/ffffff
384,d2a3c0b8-3ec5-4e16-a9b9-e5614c015218,est phasellus sit,at turpis donec posuere metus vitae ipsum aliquam non mauris morbi non lectus aliquam sit amet,6edde670-2289-4f38-bc74-e1b1800644d8,1/24/2023,FPS,http://dummyimage.com/130x100.png/cc0000/ffffff
385,9bdc1b5b-b882-4ba1-b2ad-54093f1fdefd,nisl venenatis lacinia,aliquam sit amet diam in magna bibendum imperdiet nullam orci pede venenatis,a465a5dd-93a5-4def-8762-b742bfb1bfea,7/25/2023,Adventure,http://dummyimage.com/144x100.png/dddddd/000000
386,46dd008a-36f7-4939-9176-eca6ab1b5571,at dolor,id pretium iaculis diam erat fermentum justo nec condimentum neque sapien placerat ante nulla justo aliquam quis turpis eget,6efc9fe5-23bc-45e2-8d5e-8fc849dc2ab9,3/20/2023,Horor,http://dummyimage.com/102x100.png/ff4444/ffffff
387,078d30db-8ae2-4909-be08-5b69f31f911a,sed accumsan felis,sed nisl nunc rhoncus dui vel sem sed sagittis nam congue,996e8088-c188-4879-b260-5459ec534e6e,5/23/2023,Adventure,http://dummyimage.com/220x100.png/cc0000/ffffff
388,a765e146-8e48-431f-bd27-7c419f4d8665,elementum,scelerisque quam turpis adipiscing lorem vitae mattis nibh ligula nec sem duis aliquam convallis nunc proin at turpis a pede,d82d376d-96f1-4d84-af76-ec6fe7f07239,10/2/2023,Sports,http://dummyimage.com/186x100.png/5fa2dd/ffffff
389,5a9288db-08d0-4c01-9c30-f1e2b3b0cc63,tincidunt ante vel,sed vestibulum sit amet cursus id turpis integer aliquet massa id lobortis convallis tortor risus,1eda5169-6246-47ba-9039-c769069fc5fe,5/12/2023,Open World,http://dummyimage.com/147x100.png/dddddd/000000
390,ea2c47a4-1cac-4077-bad2-5ff28de85941,suspendisse ornare,in imperdiet et commodo vulputate justo in blandit ultrices enim lorem ipsum dolor sit amet,b8e22ec4-bb10-4cd0-b5fb-223a0509e323,6/16/2023,Battle Royal,http://dummyimage.com/153x100.png/5fa2dd/ffffff
391,b0033238-b17f-4db6-8e03-7430be2e101e,iaculis justo in,sit amet consectetuer adipiscing elit proin risus praesent lectus vestibulum quam sapien varius ut blandit non,ea0027c7-1c6a-46b8-b6b3-5d70fbc107e9,10/15/2023,Horor,http://dummyimage.com/117x100.png/5fa2dd/ffffff
392,e2f1045e-add6-442c-a53c-0c72670f1f06,quam fringilla,sed accumsan felis ut at dolor quis odio consequat varius,1d671f8b-effd-4cea-8199-6192d27927dc,7/21/2023,Sports,http://dummyimage.com/102x100.png/5fa2dd/ffffff
393,b5312580-c106-44a3-b3ed-3ab9f92d1976,elementum in,ut nunc vestibulum ante ipsum primis in faucibus orci luctus et ultrices posuere cubilia curae mauris,207dc6df-12eb-4957-b5b5-d7806b0e9c06,3/11/2023,Horor,http://dummyimage.com/152x100.png/dddddd/000000
394,955b4856-0b54-49fe-a13b-e91a7a6e4557,suspendisse accumsan,a feugiat et eros vestibulum ac est lacinia nisi venenatis tristique fusce congue diam id ornare imperdiet sapien,6c84e779-1eef-42e9-bd59-e2b8c4d6a31e,6/27/2023,Adventure,http://dummyimage.com/136x100.png/5fa2dd/ffffff
395,59f0a66b-505d-4016-8f99-49a89a667378,rhoncus mauris enim,sed lacus morbi sem mauris laoreet ut rhoncus aliquet pulvinar sed nisl,3bfd6f81-36ba-4ad9-9857-19d2a1962d6d,5/3/2023,Horor,http://dummyimage.com/140x100.png/5fa2dd/ffffff
396,946a4f03-bf36-4e59-bdce-ccb8b6d43cfd,odio porttitor id,sociis natoque penatibus et magnis dis parturient montes nascetur ridiculus mus etiam vel augue vestibulum rutrum rutrum,c69c1531-fb05-4f55-8220-02212f233eb6,12/17/2023,Horor,http://dummyimage.com/194x100.png/ff4444/ffffff
397,ef5bdfe3-25a0-44d0-a784-5aac65270b2d,sagittis nam,et tempus semper est quam pharetra magna ac consequat metus sapien ut nunc vestibulum ante,2baa287e-f90f-462c-bd3d-d528f2379430,12/14/2023,Adventure,http://dummyimage.com/172x100.png/ff4444/ffffff
398,0be5e4de-e6c8-479f-bbfa-e8ce70c0fbb3,in hac,purus eu magna vulputate luctus cum sociis natoque penatibus et magnis dis parturient montes nascetur ridiculus mus vivamus,f1286c0a-8645-474e-88cf-f1e361b3c9f0,11/17/2023,Sports,http://dummyimage.com/148x100.png/5fa2dd/ffffff
399,936eb5c2-4e89-4c1f-8322-a3af6815cb87,porttitor pede justo,nullam sit amet turpis elementum ligula vehicula consequat morbi a ipsum integer a nibh in quis justo maecenas,9e0705bd-ffa7-4564-9f54-805990708859,8/1/2023,Adventure,http://dummyimage.com/225x100.png/dddddd/000000
400,73990f33-06df-407e-9622-b6531fb2063e,non,libero nam dui proin leo odio porttitor id consequat in consequat ut nulla sed accumsan felis ut at dolor quis,8c03d587-678b-4489-8a29-47e7a1083fdf,10/29/2023,FPS,http://dummyimage.com/153x100.png/cc0000/ffffff
401,3361a490-fa13-42b9-8605-23177429a142,sagittis sapien,ac est lacinia nisi venenatis tristique fusce congue diam id ornare imperdiet,07512c9d-c41c-4813-9de8-a9b72faf0d0e,6/17/2023,Horor,http://dummyimage.com/178x100.png/cc0000/ffffff
402,b46d32ba-09d7-4668-8f32-835f808093d0,dui,faucibus cursus urna ut tellus nulla ut erat id mauris vulputate elementum,7edcf4ac-bf7d-4fa5-a5f1-69a34ec38266,12/14/2023,Moba,http://dummyimage.com/115x100.png/ff4444/ffffff
403,d7041f20-0138-470e-9431-6526033d5c91,curae duis faucibus,vel pede morbi porttitor lorem id ligula suspendisse ornare consequat lectus in est risus auctor sed tristique in tempus,00676bc4-a3f2-4b1b-99eb-ffe0dc315afb,7/4/2023,FPS,http://dummyimage.com/153x100.png/ff4444/ffffff
404,310308ac-4873-410c-b2e1-c99b9d82298c,et,ipsum integer a nibh in quis justo maecenas rhoncus aliquam lacus,3eb98c6c-f2a2-49e9-91ec-4ddfa901d07d,10/20/2023,RPG,http://dummyimage.com/157x100.png/dddddd/000000
405,3b30817b-85e7-4860-b8b6-6ab979868948,donec semper sapien,tincidunt eu felis fusce posuere felis sed lacus morbi sem mauris laoreet,21f5cd21-6c60-45b6-a6fc-8197685264b5,8/28/2023,RPG,http://dummyimage.com/126x100.png/dddddd/000000
406,b9aef153-c3fd-4761-84e6-4ec072da64f2,justo etiam pretium,sit amet lobortis sapien sapien non mi integer ac neque duis bibendum morbi,ba8fbb13-9e18-429e-b09c-ea7bf7f65b3a,3/24/2023,Sports,http://dummyimage.com/201x100.png/ff4444/ffffff
407,762afced-1113-48da-a443-5ec339ef00d6,at dolor,quisque arcu libero rutrum ac lobortis vel dapibus at diam nam tristique,664415e2-1265-47e4-9be7-68f5d2cdefb7,4/25/2023,Battle Royal,http://dummyimage.com/201x100.png/ff4444/ffffff
408,0dc75840-74f2-49da-85b4-71e44c4437ee,luctus et,felis sed interdum venenatis turpis enim blandit mi in porttitor pede,abd356c0-2ca0-49ef-baaf-31bfbd276c60,5/31/2023,Horor,http://dummyimage.com/207x100.png/dddddd/000000
