id_project,project_id,project_name,project_desc,user_id,deadline,game_type,imgUrl
1,95b65dfc-4c29-43c7-9ee0-49c72e1683bc,ultrices posuere cubilia,eget congue eget semper rutrum nulla nunc purus phasellus in felis donec semper sapien a libero nam dui proin leo,1852e7f9-15bf-413a-8597-dcf959f064c9,8/30/2023,Puzzle,http://dummyimage.com/105x100.png/ff4444/ffffff
2,9c30f84f-43c7-454f-b3db-417239996d03,a ipsum integer,erat id mauris vulputate elementum nullam varius nulla facilisi cras non velit nec nisi vulputate,56cbe3ca-03ca-4732-98d8-a4d829dcaefb,7/19/2023,Sports,http://dummyimage.com/163x100.png/dddddd/000000
3,b7616ed8-6229-4ee8-99ff-05194db122fe,semper,sapien in sapien iaculis congue vivamus metus arcu adipiscing molestie hendrerit at vulputate vitae nisl aenean lectus,a471dc72-1fdb-4399-9139-1a72710c946f,6/20/2023,Sports,http://dummyimage.com/130x100.png/cc0000/ffffff
4,da112880-bbac-4753-a718-60036a43fb38,amet consectetuer adipiscing,mi nulla ac enim in tempor turpis nec euismod scelerisque quam turpis adipiscing lorem vitae mattis nibh,f64de449-749b-4254-b344-774443c2b4a5,5/24/2023,Horor,http://dummyimage.com/229x100.png/ff4444/ffffff
5,5ebb1f26-74d2-4c07-8e50-dd25d4c4e741,nulla,nam nulla integer pede justo lacinia eget tincidunt eget tempus vel pede morbi porttitor lorem id ligula suspendisse ornare,9350b6ed-5f7f-4157-8976-2a3afd11edf1,11/28/2023,Sports,http://dummyimage.com/151x100.png/cc0000/ffffff
6,42434bb0-aa9d-4e5c-bd95-045b115f6805,dapibus nulla,et magnis dis parturient montes nascetur ridiculus mus vivamus vestibulum,7a3b812d-20e0-445b-9a62-e387e8f90834,9/10/2023,FPS,http://dummyimage.com/228x100.png/5fa2dd/ffffff
7,d80c298e-cfe7-4bf5-bb4c-a428e0bd82a5,lorem vitae mattis,sed nisl nunc rhoncus dui vel sem sed sagittis nam congue risus,243df03e-ecf6-4064-9a7e-91b605397a8e,7/23/2023,Battle Royal,http://dummyimage.com/181x100.png/ff4444/ffffff
8,0cf3c094-df04-4096-942e-1b7b38412b48,in,nulla ac enim in tempor turpis nec euismod scelerisque quam turpis adipiscing,61bf51b9-f888-43d5-bce4-710a7944f7bf,1/3/2023,Adventure,http://dummyimage.com/195x100.png/dddddd/000000
9,27233137-c80b-47d5-bb86-b27816c4b98c,sed,rutrum rutrum neque aenean auctor gravida sem praesent id massa id nisl venenatis lacinia aenean sit amet justo morbi,6e36ffd6-8c4a-414a-9f78-c90941bd0369,6/7/2023,Battle Royal,http://dummyimage.com/166x100.png/cc0000/ffffff
10,aae25945-265f-483e-b71b-3f817b18230c,praesent id massa,ac est lacinia nisi venenatis tristique fusce congue diam id ornare imperdiet sapien,9db97843-a695-4b50-9b35-dc1c562a903f,9/30/2023,FPS,http://dummyimage.com/154x100.png/cc0000/ffffff
11,284863fc-7895-4533-8c29-e5bb84f5b0e7,cras non,leo odio condimentum id luctus nec molestie sed justo pellentesque viverra pede ac diam,23290f82-1920-4b59-b65d-b05b0b9a691c,2/6/2023,Puzzle,http://dummyimage.com/108x100.png/dddddd/000000
12,e6c8d22a-f58a-42be-8e54-1fea1dc55290,nunc,semper porta volutpat quam pede lobortis ligula sit amet eleifend pede libero quis orci nullam molestie nibh in lectus,25bdcdf1-b46b-4aa9-a977-9195245a30e8,10/10/2023,Adventure,http://dummyimage.com/212x100.png/dddddd/000000
13,15267802-883a-4884-a4b3-68adcf7a7db7,diam cras,luctus rutrum nulla tellus in sagittis dui vel nisl duis ac nibh fusce lacus,7d3db6ad-f127-4d8b-99a7-dbabf8cad50f,9/20/2023,Puzzle,http://dummyimage.com/210x100.png/dddddd/000000
14,ed015d97-e7ac-4d82-b6dc-c603c04c43e5,duis bibendum morbi,eu massa donec dapibus duis at velit eu est congue,57a19e61-089f-471d-9bfa-b5381883fd89,9/16/2023,RPG,http://dummyimage.com/226x100.png/5fa2dd/ffffff
15,4713035b-8f07-4971-b453-b98351bab1b3,cubilia,augue vestibulum rutrum rutrum neque aenean auctor gravida sem praesent id massa,8dd2fd46-1e41-4587-b0ca-a253d9af5e97,2/26/2023,Battle Royal,http://dummyimage.com/122x100.png/5fa2dd/ffffff
16,fbde192f-f4a7-4f46-9087-a50f30f38400,quam fringilla rhoncus,primis in faucibus orci luctus et ultrices posuere cubilia curae nulla dapibus dolor vel est donec odio,c39432b6-78a5-4027-9b3e-0df36aabcb59,8/15/2023,Moba,http://dummyimage.com/205x100.png/dddddd/000000
17,a0ac325b-a43e-4072-8bd6-e12bf20ab954,etiam vel augue,eget congue eget semper rutrum nulla nunc purus phasellus in felis donec,762e2028-3547-4cfc-ae1c-899f94298081,11/28/2023,Sports,http://dummyimage.com/246x100.png/cc0000/ffffff
18,7fb53514-1ad4-47d1-88ac-283c624921da,consequat,quam sapien varius ut blandit non interdum in ante vestibulum,52ae5cc9-45a0-4c41-921c-6487c2dc42b5,2/24/2023,FPS,http://dummyimage.com/143x100.png/dddddd/000000
19,cdb48b7d-adbf-487e-aa68-2080e23c2752,nulla neque,maecenas pulvinar lobortis est phasellus sit amet erat nulla tempus vivamus in felis eu sapien cursus vestibulum proin,6704f501-da78-45e2-b60f-1482d1208cbc,9/15/2023,Moba,http://dummyimage.com/177x100.png/5fa2dd/ffffff
20,77c45cee-5d19-498b-b759-7cd46319b2f2,habitasse platea dictumst,faucibus accumsan odio curabitur convallis duis consequat dui nec nisi volutpat eleifend donec ut dolor morbi vel lectus in quam,7762cecc-7f8d-4028-b959-5b8ce7b93b90,5/22/2023,RPG,http://dummyimage.com/233x100.png/ff4444/ffffff
21,6cd21ec1-ac8d-4564-aff9-b2d55bd0e0ff,nulla sed,lacus morbi sem mauris laoreet ut rhoncus aliquet pulvinar sed nisl nunc rhoncus dui,f02b8848-337b-48e5-8ddb-85b838307974,6/4/2023,FPS,http://dummyimage.com/227x100.png/cc0000/ffffff
22,fb240112-25d6-4e87-886f-64d1f1fc8c45,tempus vivamus,massa donec dapibus duis at velit eu est congue elementum in hac habitasse platea dictumst morbi,355c4f1a-7274-48d4-a9af-aa687fad2649,6/7/2023,Open World,http://dummyimage.com/237x100.png/dddddd/000000
23,9883590e-e906-4b48-a7b0-569c2a04bd4f,odio,diam neque vestibulum eget vulputate ut ultrices vel augue vestibulum ante ipsum primis in faucibus orci,864bfe46-7ad5-4edc-9b9e-d62e4e9fb2d6,4/4/2023,Puzzle,http://dummyimage.com/200x100.png/dddddd/000000
24,2be1bd6c-5167-4042-8c9b-215e1b1ec988,ut erat id,vestibulum velit id pretium iaculis diam erat fermentum justo nec condimentum neque,c3264ea5-b8db-4775-9545-8c43a66c1ff2,1/29/2023,Horor,http://dummyimage.com/155x100.png/ff4444/ffffff
25,505dd7cd-1ff5-4761-b608-4bc1e5a22748,nec sem,sed ante vivamus tortor duis mattis egestas metus aenean fermentum donec ut mauris eget massa tempor convallis nulla neque,03c41c39-6c5e-4cc3-b41a-f06d37d5d295,9/26/2023,RPG,http://dummyimage.com/105x100.png/dddddd/000000
26,ab7f1ba0-754a-49d6-8f7a-42915799620a,purus sit amet,curae duis faucibus accumsan odio curabitur convallis duis consequat dui,1e11ad3d-a96d-483a-96f4-daf996971eeb,8/30/2023,Open World,http://dummyimage.com/195x100.png/5fa2dd/ffffff
27,d4d6b335-0e79-4b27-8f0f-13cbf7e68f8a,eget tincidunt eget,id consequat in consequat ut nulla sed accumsan felis ut at dolor quis odio consequat varius,81772c7d-f1f2-4978-87ce-faa73e2d6472,1/3/2023,Battle Royal,http://dummyimage.com/145x100.png/5fa2dd/ffffff
28,bd27500d-246b-40e8-a200-7867002d13dc,auctor,vivamus vestibulum sagittis sapien cum sociis natoque penatibus et magnis dis,dbee512d-21da-4ab6-a225-29da960723e5,12/21/2022,Puzzle,http://dummyimage.com/142x100.png/cc0000/ffffff
29,c6e2c6cd-408c-41d4-b459-bba2d14f7cca,odio,cubilia curae mauris viverra diam vitae quam suspendisse potenti nullam porttitor lacus at turpis donec posuere metus vitae ipsum,5a968549-c3f7-4368-8cf6-4e933107f313,10/28/2023,Adventure,http://dummyimage.com/233x100.png/ff4444/ffffff
30,344a7de1-f2a1-4ccd-9e42-ce4d159fc8df,eget,placerat praesent blandit nam nulla integer pede justo lacinia eget tincidunt eget tempus vel pede morbi porttitor,f57bf947-9b2d-41c6-ac82-9eaaf24b5971,12/28/2022,Battle Royal,http://dummyimage.com/204x100.png/5fa2dd/ffffff
31,50e9d791-c06f-47f7-9256-f65ff094dbd3,lorem ipsum dolor,auctor sed tristique in tempus sit amet sem fusce consequat nulla nisl nunc nisl duis bibendum felis sed interdum,0ff25d2d-bdf3-45cf-a2f7-5eebcc79e66f,7/21/2023,Battle Royal,http://dummyimage.com/225x100.png/ff4444/ffffff
32,a74e563d-e328-46b1-9993-f1eae8543a39,augue vel accumsan,rutrum nulla nunc purus phasellus in felis donec semper sapien a libero nam dui proin leo odio,7a1ab414-db68-49e5-b1d6-93a8e5dbb11e,12/17/2023,Open World,http://dummyimage.com/156x100.png/ff4444/ffffff
33,5c1e9fc4-692d-428d-bbe7-d993de749648,ipsum integer,tempus semper est quam pharetra magna ac consequat metus sapien ut nunc,aec2a44d-bd1f-4f7e-83ca-523f4d02580a,12/12/2023,Open World,http://dummyimage.com/101x100.png/ff4444/ffffff
34,af8fe6d1-fe71-478b-929c-d4b93d02f6fd,consequat in,volutpat convallis morbi odio odio elementum eu interdum eu tincidunt in,b8f5c18a-b9a3-4e53-9589-705086d18d70,9/11/2023,Moba,http://dummyimage.com/102x100.png/cc0000/ffffff
35,75a2d6e7-592e-4e0f-99db-5e4ae2e783b4,in congue,enim sit amet nunc viverra dapibus nulla suscipit ligula in lacus curabitur at ipsum,8aff8364-39fa-4214-9d52-368411689e51,4/7/2023,FPS,http://dummyimage.com/115x100.png/ff4444/ffffff
36,e222064b-838f-4a14-a2d6-7e9f28691578,eu interdum,fermentum justo nec condimentum neque sapien placerat ante nulla justo,9d1524d5-370b-4750-8008-f5799d525b4e,2/19/2023,Sports,http://dummyimage.com/215x100.png/5fa2dd/ffffff
37,080f8067-359e-4a4b-b08f-ec20351a9642,tortor id,nulla tellus in sagittis dui vel nisl duis ac nibh fusce lacus purus aliquet at feugiat non pretium,ca9bdc5a-81d3-48f8-9064-7f89a982012e,5/4/2023,Moba,http://dummyimage.com/158x100.png/ff4444/ffffff
38,71ca1881-bc8c-4738-ba90-343d654744a5,vel,integer ac leo pellentesque ultrices mattis odio donec vitae nisi nam ultrices libero non mattis pulvinar nulla pede ullamcorper,1ba073fe-2042-4ba5-9480-78dc6d646038,6/15/2023,FPS,http://dummyimage.com/152x100.png/cc0000/ffffff
39,e0118f1a-19e2-4795-a22f-9169703243c9,sociis natoque,morbi sem mauris laoreet ut rhoncus aliquet pulvinar sed nisl nunc rhoncus dui vel sem sed sagittis nam,f55ba781-65c3-4efb-88a7-f62edb549746,7/19/2023,Battle Royal,http://dummyimage.com/197x100.png/ff4444/ffffff
40,955e7608-cbff-4b75-b990-c76087b2e728,diam neque vestibulum,cursus vestibulum proin eu mi nulla ac enim in tempor,0f5b21e0-0aee-44ea-b77a-a28ae2b23b85,7/16/2023,FPS,http://dummyimage.com/228x100.png/5fa2dd/ffffff
41,42a55566-8e03-4e1e-a513-41fdf9918c82,ante ipsum primis,orci luctus et ultrices posuere cubilia curae mauris viverra diam vitae quam,aa782b77-3dfe-43c3-8854-4c9565621086,3/2/2023,Adventure,http://dummyimage.com/173x100.png/cc0000/ffffff
42,2fdef8de-39b1-4cc3-96f9-869d4c9b5abf,in est,amet justo morbi ut odio cras mi pede malesuada in imperdiet,73176e8a-4624-484a-9fe1-99c05a1b347d,6/28/2023,Horor,http://dummyimage.com/165x100.png/dddddd/000000
43,31e98a33-89a5-46da-98fb-12bc83ba8c96,accumsan felis ut,morbi a ipsum integer a nibh in quis justo maecenas rhoncus aliquam lacus morbi quis tortor,61d2bee1-9d44-4475-8935-b9c698b939bd,8/4/2023,Puzzle,http://dummyimage.com/141x100.png/cc0000/ffffff
44,a585ae18-b613-433c-8ba6-d3ace51ce987,porttitor,lectus suspendisse potenti in eleifend quam a odio in hac habitasse platea dictumst maecenas,2a941fa2-96bc-4370-8991-1b9b99792357,1/20/2023,RPG,http://dummyimage.com/112x100.png/dddddd/000000
45,8af04717-0dd3-4f9f-8326-817486020dd0,at turpis donec,lobortis convallis tortor risus dapibus augue vel accumsan tellus nisi eu orci mauris lacinia sapien quis libero nullam sit,75075765-a55f-43b0-b721-8831e810cae4,3/6/2023,Adventure,http://dummyimage.com/177x100.png/dddddd/000000
46,0ae0f9d5-1df8-43ee-b481-17d30a882e95,duis,sapien sapien non mi integer ac neque duis bibendum morbi non,45137835-361d-4d22-bcae-0506db3f1f04,5/1/2023,Horor,http://dummyimage.com/155x100.png/ff4444/ffffff
47,ce70c9d8-d4a6-4d13-a805-9931ead2c0a9,vestibulum ante ipsum,cras in purus eu magna vulputate luctus cum sociis natoque penatibus et magnis dis parturient montes nascetur,6471de4c-5099-42b4-bd96-5ed89b6cdc9a,3/1/2023,Moba,http://dummyimage.com/131x100.png/dddddd/000000
48,89c5e797-885e-49aa-a997-085eae9e8c30,amet consectetuer adipiscing,eleifend pede libero quis orci nullam molestie nibh in lectus pellentesque at nulla suspendisse potenti cras,14a667d8-4e8e-46cc-bdb6-72e3cc05ca8c,2/25/2023,Battle Royal,http://dummyimage.com/222x100.png/dddddd/000000
49,388fe7f7-f529-485e-a529-24d78e4b8749,sapien cum sociis,in magna bibendum imperdiet nullam orci pede venenatis non sodales sed tincidunt eu felis fusce posuere felis sed,319c6a93-5534-4884-850a-592b0298adc4,2/25/2023,Horor,http://dummyimage.com/194x100.png/dddddd/000000
50,998e1fb8-0b04-4680-90ec-7cb0a9c84794,facilisi cras non,vel augue vestibulum ante ipsum primis in faucibus orci luctus et ultrices posuere cubilia curae donec pharetra magna vestibulum aliquet,49c01a56-34e4-4593-a0f0-7e3eae471b71,8/25/2023,RPG,http://dummyimage.com/145x100.png/5fa2dd/ffffff
51,c2e70d4e-8f9e-4517-8870-08448031b7b7,luctus ultricies,in magna bibendum imperdiet nullam orci pede venenatis non sodales sed tincidunt eu,8cbd9d52-4d90-4617-90f8-7a5ef457fde7,4/15/2023,Sports,http://dummyimage.com/194x100.png/cc0000/ffffff
52,1eeb2a00-16be-474b-a34b-9734fed219b2,ligula,in hac habitasse platea dictumst aliquam augue quam sollicitudin vitae,8d7ebf78-054c-418b-b7d5-6ae5abb2ca36,7/30/2023,RPG,http://dummyimage.com/207x100.png/dddddd/000000
53,d2206a58-6d55-4806-9187-26835efe4a7a,curabitur,pellentesque at nulla suspendisse potenti cras in purus eu magna vulputate luctus cum sociis,8c10ad7d-5b9f-4d61-abf0-4490d6203a65,7/2/2023,Moba,http://dummyimage.com/152x100.png/cc0000/ffffff
54,cc95c611-9f5a-47b9-980a-a0e806db361d,quisque ut,quam pharetra magna ac consequat metus sapien ut nunc vestibulum ante ipsum primis in,68718111-fa3e-4c25-858f-75407c4a12df,4/11/2023,Puzzle,http://dummyimage.com/175x100.png/5fa2dd/ffffff
55,d8218379-e89e-4ed6-b2fa-3ff39f707855,nam,vel enim sit amet nunc viverra dapibus nulla suscipit ligula in lacus curabitur at ipsum ac tellus semper interdum,8210cf64-d46f-46d2-97c2-69cc770ac402,1/31/2023,Open World,http://dummyimage.com/144x100.png/5fa2dd/ffffff
56,540fbd96-0984-46ee-bb2b-9466ee7c1582,non pretium,vivamus vestibulum sagittis sapien cum sociis natoque penatibus et magnis dis parturient montes nascetur ridiculus,3c98cb18-872f-4c96-8afb-de24b62368cd,6/1/2023,Moba,http://dummyimage.com/107x100.png/cc0000/ffffff
57,d2984beb-72d2-49e6-963e-96270bc99c70,eget rutrum,dictumst aliquam augue quam sollicitudin vitae consectetuer eget rutrum at lorem integer tincidunt ante vel ipsum praesent blandit,8d90d188-59b7-4710-b1b5-22848cf23573,4/19/2023,Puzzle,http://dummyimage.com/141x100.png/dddddd/000000
58,07bcab56-c796-4af7-b1c6-444a5ab6a444,nec nisi vulputate,porta volutpat quam pede lobortis ligula sit amet eleifend pede libero quis orci nullam molestie nibh,03bd2e89-bc63-41f1-a56c-dc713dd769f3,11/22/2023,Open World,http://dummyimage.com/110x100.png/dddddd/000000
59,bc3bcb66-131e-4ad8-adda-8d571157511d,ipsum primis,commodo vulputate justo in blandit ultrices enim lorem ipsum dolor sit amet consectetuer adipiscing elit,95e0b826-cea5-4189-a45b-7a386485cd46,8/26/2023,Puzzle,http://dummyimage.com/109x100.png/dddddd/000000
60,9e83c53f-0a13-4b30-86aa-7aa549589d08,dignissim,vel augue vestibulum ante ipsum primis in faucibus orci luctus et ultrices posuere cubilia curae donec,221cd912-081e-4005-8614-f3594d75b6d7,5/7/2023,FPS,http://dummyimage.com/167x100.png/dddddd/000000
61,c953084a-aa42-4bf3-b143-c54ddf750656,a,vehicula condimentum curabitur in libero ut massa volutpat convallis morbi odio odio elementum eu interdum eu,396e61ae-f797-4932-8677-0b39fd6d95e5,10/11/2023,Open World,http://dummyimage.com/237x100.png/dddddd/000000
62,321dbe27-dd94-4c55-9be1-dfdfdd52db60,tellus nulla,donec pharetra magna vestibulum aliquet ultrices erat tortor sollicitudin mi sit amet lobortis sapien,8b024448-6282-4abc-95a6-14e7e8fffd1d,3/15/2023,Adventure,http://dummyimage.com/192x100.png/dddddd/000000
63,ed84fd0c-1105-4978-a8ec-b47a8086be16,pharetra,at lorem integer tincidunt ante vel ipsum praesent blandit lacinia erat vestibulum sed magna at nunc commodo placerat praesent,23bc3f47-e84d-47f0-a15d-837e00ea0174,4/29/2023,FPS,http://dummyimage.com/227x100.png/5fa2dd/ffffff
64,af3c29cb-632e-47ee-ac84-103ba07b4cd3,venenatis tristique,in hac habitasse platea dictumst maecenas ut massa quis augue luctus tincidunt,b7112691-04d0-4695-951f-c4ce2e6855a4,9/25/2023,Open World,http://dummyimage.com/157x100.png/cc0000/ffffff
65,cb5663b1-e332-4526-af1d-5bd596c62aec,elit sodales scelerisque,arcu sed augue aliquam erat volutpat in congue etiam justo,f1647a26-70d2-4eff-9800-01384ae5589f,7/1/2023,Battle Royal,http://dummyimage.com/186x100.png/5fa2dd/ffffff
66,faf65e49-6dfa-4e0b-9947-b0b33fd507fd,diam cras,pede justo lacinia eget tincidunt eget tempus vel pede morbi,078a5ffc-d152-41e9-bf10-2900e29dcc13,7/5/2023,Horor,http://dummyimage.com/194x100.png/5fa2dd/ffffff
67,c8174a17-1644-461b-9a87-3baf1afc17b6,ut,dolor sit amet consectetuer adipiscing elit proin interdum mauris non ligula pellentesque ultrices phasellus id sapien in sapien,c332da64-47aa-403f-9b46-dd6564f010aa,8/21/2023,RPG,http://dummyimage.com/115x100.png/dddddd/000000
68,69cc3ab9-3de3-4582-9dc8-beb4467637e4,justo sit,erat eros viverra eget congue eget semper rutrum nulla nunc purus phasellus in felis,3f1e4059-d149-457d-b981-60cfed80a9ff,1/23/2023,RPG,http://dummyimage.com/166x100.png/dddddd/000000
69,22b4546a-3fad-4ee1-bf28-d4ca862ca359,purus phasellus,ultrices posuere cubilia curae mauris viverra diam vitae quam suspendisse potenti nullam,b787aa6d-9a29-47ec-a60d-bff6d40b8e92,6/10/2023,Battle Royal,http://dummyimage.com/249x100.png/dddddd/000000
70,30ef2b4c-bd07-4721-a836-c2639a5cc2d6,mauris lacinia,sed tristique in tempus sit amet sem fusce consequat nulla nisl nunc nisl,147e8b80-f0db-49fa-8156-e35577392871,4/6/2023,Puzzle,http://dummyimage.com/146x100.png/dddddd/000000
71,2fa9ebab-c776-4ae6-a4de-c9fb12cb7e7f,eros elementum,mi pede malesuada in imperdiet et commodo vulputate justo in blandit ultrices enim,7da3fe3c-17a7-4154-92b6-f0cab31f3eb5,7/14/2023,Adventure,http://dummyimage.com/231x100.png/5fa2dd/ffffff
72,77d34505-c74a-4e8d-aece-b3bcccbe9d89,sem praesent id,porttitor lacus at turpis donec posuere metus vitae ipsum aliquam non mauris,f19b089d-7774-4b33-bbe1-bf7d28b74c97,11/20/2023,Moba,http://dummyimage.com/231x100.png/5fa2dd/ffffff
73,dd04a0a9-bcb8-445c-9f75-f50b72ffe7d4,placerat,proin leo odio porttitor id consequat in consequat ut nulla sed accumsan felis ut at dolor quis odio consequat varius,5c35ce95-463a-4db7-bc72-3f200f15ea29,5/16/2023,Puzzle,http://dummyimage.com/249x100.png/ff4444/ffffff
74,ce766ca1-a8ef-4cad-88c4-fe89c7bff8a1,amet sapien dignissim,at feugiat non pretium quis lectus suspendisse potenti in eleifend quam a,95b880d9-30ca-4f36-9616-949db1dee4bd,7/20/2023,Puzzle,http://dummyimage.com/121x100.png/cc0000/ffffff
75,12555d26-eb5d-443d-a93b-5ab1f3bf6ba9,faucibus accumsan,suspendisse accumsan tortor quis turpis sed ante vivamus tortor duis mattis egestas metus aenean fermentum donec ut mauris eget massa,5a60bef6-2651-4ec1-a7ef-b74bda995f12,1/26/2023,Horor,http://dummyimage.com/235x100.png/dddddd/000000
76,3cb58927-1fab-4055-a1a4-60bdc28d8e0b,elit,sed accumsan felis ut at dolor quis odio consequat varius integer ac leo pellentesque ultrices mattis odio donec,04d042f8-d384-4eaa-8751-14b606160f74,5/12/2023,Moba,http://dummyimage.com/143x100.png/cc0000/ffffff
77,bfbdba4c-860c-40d3-a421-e5aa454ea68f,odio,sit amet lobortis sapien sapien non mi integer ac neque,c29175db-54d8-4d61-bda9-df88ab0ddc40,8/30/2023,Horor,http://dummyimage.com/141x100.png/ff4444/ffffff
78,2fd21368-26ef-4cb3-a051-ff5c4d6634ec,ornare,vestibulum sed magna at nunc commodo placerat praesent blandit nam,edb3b216-36f9-490c-a336-b873d0f0e9a0,11/16/2023,Moba,http://dummyimage.com/100x100.png/ff4444/ffffff
79,3ae99d01-d42d-4937-b3f9-abdf3229a74a,orci,aliquam convallis nunc proin at turpis a pede posuere nonummy integer non velit,6e9ce39e-9768-4695-abd4-88696efdf913,6/7/2023,Horor,http://dummyimage.com/197x100.png/cc0000/ffffff
80,f85fe5a9-bc79-4d50-b438-3884f717dbe5,dolor,non velit donec diam neque vestibulum eget vulputate ut ultrices vel augue vestibulum,6791c3d3-34bd-4349-a5b3-f96b523551a1,7/14/2023,Puzzle,http://dummyimage.com/220x100.png/cc0000/ffffff
81,55239e0b-c14f-41ce-a309-c05e701f8aca,amet,magna bibendum imperdiet nullam orci pede venenatis non sodales sed tincidunt,29d62d75-995d-4c22-b7a5-4d2b68b1e1a8,2/5/2023,Horor,http://dummyimage.com/109x100.png/ff4444/ffffff
82,35bae341-c516-4cb2-9f51-ffdcaac4604d,urna ut tellus,luctus et ultrices posuere cubilia curae mauris viverra diam vitae quam suspendisse potenti nullam porttitor lacus at,32c3237f-8f88-4c9d-94d8-6b2bc17af62a,11/28/2023,Battle Royal,http://dummyimage.com/103x100.png/dddddd/000000
83,501f17f4-cdac-4561-a36f-a08ae70cf649,iaculis,tincidunt lacus at velit vivamus vel nulla eget eros elementum pellentesque quisque porta volutpat erat quisque erat,7c573411-7eab-4c0b-8cb6-b3ec105c98e3,11/10/2023,Sports,http://dummyimage.com/211x100.png/ff4444/ffffff
84,51d69fab-f25a-4a29-8edc-60bcd1892214,in,vel pede morbi porttitor lorem id ligula suspendisse ornare consequat lectus in est risus auctor sed tristique in tempus,54633b4a-e11b-4ed6-ae59-cf4819e68f67,8/30/2023,RPG,http://dummyimage.com/236x100.png/5fa2dd/ffffff
85,6faad531-57a8-42af-a1b0-9bd4dc2ed00d,convallis eget eleifend,arcu sed augue aliquam erat volutpat in congue etiam justo etiam pretium iaculis justo,0f6818d6-52c5-43d1-a604-403d298db891,12/24/2022,FPS,http://dummyimage.com/197x100.png/ff4444/ffffff
86,33610dea-60de-437d-9ebb-629e4afc2245,in hac habitasse,turpis donec posuere metus vitae ipsum aliquam non mauris morbi non,0fc6614f-d6fa-4a13-8879-810f0ac55996,4/11/2023,Battle Royal,http://dummyimage.com/111x100.png/dddddd/000000
87,56d43594-5777-428f-8deb-82ff6a4e7af4,sapien iaculis,neque libero convallis eget eleifend luctus ultricies eu nibh quisque,65c7c10c-cdcb-4af0-8fe6-f2d9ef31200a,4/17/2023,Open World,http://dummyimage.com/129x100.png/5fa2dd/ffffff
88,d7c24708-459b-4951-b82c-b2416057de25,condimentum neque,neque sapien placerat ante nulla justo aliquam quis turpis eget elit,0d94cbe1-f9c2-46d5-8671-286ddc3e9e93,3/11/2023,FPS,http://dummyimage.com/219x100.png/cc0000/ffffff
89,b1b1be06-fd4f-4404-b1e9-21efca352fe0,eleifend,neque vestibulum eget vulputate ut ultrices vel augue vestibulum ante ipsum primis in,45ec9b04-2972-4042-b852-72c36e14f361,7/29/2023,Sports,http://dummyimage.com/174x100.png/ff4444/ffffff
90,74066d6b-b8c3-4835-a74a-36cd04a0595d,sapien arcu,non lectus aliquam sit amet diam in magna bibendum imperdiet,24639698-6c49-45bd-9e96-eeda7f6464cd,9/19/2023,Horor,http://dummyimage.com/114x100.png/dddddd/000000
91,8ab5e655-acff-4d06-af92-a4701ab7ad9d,ac tellus semper,pede libero quis orci nullam molestie nibh in lectus pellentesque at nulla suspendisse potenti cras in purus eu magna vulputate,8f591b81-a721-4d4b-9019-8761936ac663,7/1/2023,Horor,http://dummyimage.com/219x100.png/ff4444/ffffff
92,149e6dd5-462b-49a9-97f4-a66e1459e2b7,maecenas tincidunt lacus,metus aenean fermentum donec ut mauris eget massa tempor convallis nulla neque libero convallis eget,4712c096-981a-4f2d-9543-4cab81322d9e,1/18/2023,Battle Royal,http://dummyimage.com/246x100.png/5fa2dd/ffffff
93,fc1a902c-192b-401e-84f9-5d2e899e887b,vitae quam,tempus vivamus in felis eu sapien cursus vestibulum proin eu mi nulla ac enim in tempor turpis,f62c225c-b27b-4bc5-8120-a7476f280e5d,1/11/2023,Horor,http://dummyimage.com/183x100.png/ff4444/ffffff
94,723a8e15-74f2-4d2d-90ce-7e94961d955a,venenatis turpis,enim blandit mi in porttitor pede justo eu massa donec dapibus duis at velit,27d2ffd5-0d3d-4477-b205-e543ed7dd96e,9/16/2023,Moba,http://dummyimage.com/201x100.png/cc0000/ffffff
95,1808f91d-5a0c-48c9-949c-8b551117d062,mauris non,morbi a ipsum integer a nibh in quis justo maecenas rhoncus aliquam lacus,0a3c71af-8e3c-4e3a-9b51-aa506f710077,7/18/2023,Battle Royal,http://dummyimage.com/102x100.png/5fa2dd/ffffff
96,6721ef9f-411a-4d05-94ac-842d010a873a,metus,odio elementum eu interdum eu tincidunt in leo maecenas pulvinar lobortis est phasellus sit amet,60777309-578a-45ce-aa82-16d18a330d4a,4/27/2023,Adventure,http://dummyimage.com/239x100.png/dddddd/000000
97,c751c1a7-fcab-4cf2-b1d7-7a71af847dc8,interdum mauris,condimentum curabitur in libero ut massa volutpat convallis morbi odio odio elementum eu interdum eu tincidunt in leo,6ac3fc17-c7be-4f97-8afa-89f57dbe863c,3/3/2023,Open World,http://dummyimage.com/130x100.png/cc0000/ffffff
98,bac647bf-8f70-4630-8a7d-c111f04cbe61,quisque,lacinia erat vestibulum sed magna at nunc commodo placerat praesent blandit nam nulla integer pede justo lacinia eget tincidunt eget,71cc8cd8-8af5-44d4-a3c1-53f468a69abb,10/2/2023,Puzzle,http://dummyimage.com/139x100.png/cc0000/ffffff
99,252b657b-f1a2-4ad5-b4f6-88e9c841d24e,ac,quam a odio in hac habitasse platea dictumst maecenas ut,e2fced2c-8414-4418-bcd8-1ee4c751999c,8/24/2023,Horor,http://dummyimage.com/237x100.png/dddddd/000000
100,f9becb0b-9cde-4460-8169-af824e8d3685,duis,in faucibus orci luctus et ultrices posuere cubilia curae donec pharetra magna vestibulum,3579c42d-63af-4c41-8c54-f8962d998142,2/17/2023,Horor,http://dummyimage.com/110x100.png/cc0000/ffffff
101,2e65047d-32cf-476a-9066-ff9453ca0584,nunc vestibulum ante,ante ipsum primis in faucibus orci luctus et ultrices posuere cubilia curae mauris viverra diam vitae quam suspendisse potenti nullam,e51d7de6-17f2-42fa-96b8-2ba11260b861,9/6/2023,Horor,http://dummyimage.com/247x100.png/cc0000/ffffff
102,82c1c05d-7b16-4d91-b5c5-8535a5d9f58d,primis,dui vel sem sed sagittis nam congue risus semper porta,28bc8f1c-b05e-40ca-972a-de1521a42eb2,1/23/2023,Moba,http://dummyimage.com/160x100.png/ff4444/ffffff
103,c79a9421-6da9-4856-b794-4c61132e47cb,integer,id justo sit amet sapien dignissim vestibulum vestibulum ante ipsum primis in faucibus,1bcc1a0f-9949-4ca1-9f0e-66698345de06,12/27/2022,RPG,http://dummyimage.com/152x100.png/5fa2dd/ffffff
104,5ff44d7f-d4c2-4da2-813b-becb57dd3c6a,erat quisque erat,nibh in lectus pellentesque at nulla suspendisse potenti cras in purus eu magna vulputate luctus cum sociis natoque,59643fbb-f8c1-4570-be85-c2b2f3ac9f41,8/23/2023,Sports,http://dummyimage.com/223x100.png/ff4444/ffffff
